episode_link,wiki_url,description,genres,age_rating,release_date,directors,writers,cast,tags,character_names,synopsis_with_character_names
https://www.imdb.com/title/tt2002088/?ref_=ttep_ep2,,"Regina tries to push Emma out of Storybrooke and Henry's life, as flashbacks detail information about the Evil Queen's curse.",[],TV-PG,Release date,['Greg Beeman'],"['', '']",[],"['maleficent character', 'magical mirror', 'unicorn', 'father daughter relationship', 'daughter murders father', 'daughter kills father', 'apple tree', 'apple', 'the huntsman character', 'snow white character', 'prince charming character', 'jiminy cricket character', 'rumpelstiltskin character', 'magic mirror character', 'grandmother', 'little red riding hood character', 'blind witch', 'ogre', 'gnome', 'dalmatian', 'volkswagen beetle', 'volkswagen bug', 'yellow volkswagen', 'yellow car', 'evil queen from snow white character', 'adoptive mother adopted son relationship', 'based on fairy tale', 'curse', 'enchanted forest', 'erased memory', 'fairy tale', 'fairy tale fantasy', 'fireball', 'pyrokinesis', 'magical staff', 'magic staff', 'sexy villainess', 'villain with a pet animal', 'witch versus witch', 'fantasy reality crossover', 'urban fantasy', 'fantasy drama', 'teen fantasy', 'live action fantasy', 'brougham carriage', 'carriage', 'horse drawn carriage', 'horse and carriage', 'royal carriage', 'handsome prince']",[],"The next morning, the townspeople noticed the town clock has moved for the first time in 28 years. Regina (Lana Parrilla) goes through her son's storybook and notices there are missing pages near the back. She goes to Henry (Jared Gilmore) and asks where the pages are, but he says it's an old book. They've always been gone. Regina complains he thinks of her as an evil queen rather than his mother. He insists he doesn't. She asks who he does think his mother is. Regina assures him Emma (Jennifer Morrison) is no longer an issue, but then hears the town clock time. She goes to see it and notices Emma's car is still in town. Regina goes to see Emma with a basket of apples, saying they're from the tree she has had since she was a little girl. The mayor suggests Emma should enjoy them on her way home. Emma points out Regina telling her to leave is just encouraging her to stay. She wants to stay and make sure her biological son is okay. Regina says she has things under control. Emma asks what she means. Regina says she has the boy in therapy and warns Emma not to underestimate her.

The Evil Queen teleports back to her castle as Prince Charming tries to kill her by throwing his sword. The Magic Mirror (Giancarlo Esposito) asks what she's done. The Evil Queen explains she casts the Dark Curse, much to the surprise of her servant and the Magic Mirror. She then goes to the Forbidden Fortress to see Maleficent (Kristin Bauer), another evil witch. Two briefly spar verbally. The Evil Queen then demands her curse back. Maleficent say they've already made their exchange. It's hers now. She points out it's hidden in the orb on her staff and contained for good reason, and asks where it came from. The Evil Queen summons her magical forces, summoning a fireball from the fireplace. Maleficent fights back as the Evil Queen animates all of the weapons and throws them at Maleficent's pet, a black unicorn. The mistress protects her pet, but the Evil Queen binds her with the metal from the chandelier and takes the staff. When Maleficent tells her to do her worst, the Evil Queen refuses, saying she's her only friend, and ignores her friend's warning. The Dark Curse will create a void within her she can't fill. The Evil Queen accepts that and leaves.

Later, the Evil Queen meets with the other dark forces of the land and tells them today is the day they will finally emerge triumphant. They ask if they'll be happy and the Evil Queen says they will, but she needs a lock of hair from the darkest souls of the land. At her gesture, the trees around them animate, surrounding them. They each contribute a lock and the Evil Queen causes the limbs to withdraw. She then takes out the final ingredient: the heart of her prized steed from her childhood. She unleashes the Dark Curse and a column of magical smoke swirls up into the air as the others look on, but then disappears. A gnome laughs at the Evil Queen for her failure. She transforms him into a stone statue. Regina is in the garden admiring the apples and a gnome statue when the newspaper editor, Sydney (the Magic Mirror), approaches her. He has already published an article in the town newspaper, the Mirror, about Emma destroying the town's boundary marker, but admits he's learned little of Emma's background. Regina points out he's learned nothing of value and warns him to find something or she'll dispose of him.

Emma is at Granny's Diner getting breakfast when the waitress, Ruby (Meghan Ory), brings her a cup of hot chocolate. Emma assumes Sheriff Graham got it for her and goes over to him, telling him she doesn't want anything from him. Henry looks up from the next booth and says he sent it over. He invites her to walk him to school, and says his plan is to free everyone from the curse. As Emma is about to bite one of Regina's apples, Henry grabs it and throws it away. She asks why the citizens don't remember their past lives. Henry explains they all live in a haze. Emma is the only one who can free everyone. He removed the pages from the storybook to keep Regina from learning Emma is the daughter of Snow White and Prince Charming. Henry tells her to read the pages and learn about her past, but to make sure Regina doesn't see them because it would be bad if she learned who Emma is. They arrive at the school. Henry goes inside after saying that he's glad Emma believes him. His teacher, Mary Margaret, sees them talk and comes over to thank Emma for making Henry smile. She explains to Emma that Regina has managed to remain mayor through intimidation. Henry thinks she's Snow White. When Mary Margaret asks who Henry thinks Emma is, Emma lies and she says she's not in the book. Emma goes to see Archie (Raphael Sbarge) and asks why Henry thinks people are storybook characters. Archie explains Henry is using the book to deal with his problems. Emma points out Henry only got the book a month ago and his problems go back further. The psychiatrist admits Henry has had problems with his adoptive mother, and offers Emma the file. Emma wonders why he's violating doctor-patient confidentiality. Archie says Emma is very important to Henry. As she goes, Archie tells her to be careful not to destroy the boy's imagination. Once Emma leaves, Archie calls Regina and says she's right. Emma took the file. When Archie wonders why Emma came there, Regina says she's the one who gave Emma the idea.

Emma is in her room reading the file when Graham comes by and says Archie has filed a complaint. Emma stole the files. Emma shows him the files Graham arrests her. She points out she's being set up. Graham asks who would want to set her up. Regina comes to see Henry at school and tells Mary Margaret it's important. She takes him aside and tells him Emma has been arrested and she's a con woman trying to take advantage of them. Henry doesn't believe it. Regina insists she's just trying to protect them. As Graham takes Emma's mug shots, Emma warns Regina is trying to get rid of her, and asks what influence she has with the police. Henry arrives with Mary Margaret and tells Emma he knew she was gathering intel for his operation. Mary Margaret posts bail, much to Emma's surprise. Regina is working in her office when she hears a noise outside. She looks outside and sees Emma taking a chainsaw to her apple tree. Regina storms out. Emma tells her she'll have to do better than that to get her out of town, tells her it's her move, and walks away.

The Valet tells the Evil Queen perhaps it's for the best she failed, since the dark forces are more powerful than she can conceive. He assures her helping her is his life, and she asks for his help to find out why the Dark Curse didn't work. The Valet suggests she talk to Maleficent and warns after going for revenge, there's no going back. The Evil Queen wonders what she has to go back to.

Rumplestiltskin is in his cell when he realizes the rat outside his cell is the Evil Queen. She transforms to her human form and tells him the Dark Curse he gave her isn't working. Rumplestiltskin says Snow White and Prince Charming visited him. He told them only their unborn child can stop the darkness. She asks what she did wrong. Rumplestiltskin says he will in return for a good life in her new life. She must heed his every request as long as he says ""please."" The Evil Queen notes he won't remember anything if the curse succeeds, and agrees. He then tells her she needs to sacrifice the heart of something precious, not just her horse. The Evil Queen asks what will suffice. He says the heart of what she loves most. When she says what she loved most died because of Snow White, Rumplestiltskin says there must be something else and tells her to consider how far she's willing to go. The Evil Queen says she'll go as far as it takes. He says to stop wasting time and go kill it.

As Emma returns to her room, Granny (Beverley Elliott) approaches her and asks her to leave because they have a no-felons city ordinance. Granny asks for her key back. Emma hands it over.Graham comes to see Regina, who demands he arrest Emma for destroying city property. The sheriff warns Emma may be innocent and wonders who convinced Archie to lie. Regina warns him not to let a crush get the better of him. Graham agrees to arrest Emma, but warns she'll keep coming no matter what. Henry will be hurt if the situation escalates. As Emma goes to get her car, she discovers it's been booted. Regina calls and offers to meet so they can make peace. When Emma gets there, Regina apologizes and then suggests Emma wants to take Henry away. Emma denies it. She simply wants to make sure Henry is okay given his troubles. She explains Henry can't tell the difference between fantasy and reality, and thinks he's crazy. Henry overhears them and runs away. Emma realizes Regina set her up. Regina says she did know he'd be there, because she's his mother. Emma wonders how Regina has become so soulless and walks away.

The Evil Queen returns to her castle. Magic Mirror asks what happened. She ignores him and the Valet asks if she learned what she needed to know. The Evil Queen admits she's conflicted and explains what she has to do, and the Valet realizes he's the one she loves most. She calls him ""Daddy"" and admits she doesn't know what to do. He tells her to move past it, but the Evil Queen says she can't live with what Snow Queen took from her. The Valet suggests that she start over so they can have a new life, but the Evil Queen says her power will disappear and the others will think she's nothing. He tells her she can have love again and hugs her, saying they can find happiness together. However, the choice is hers. The Evil Queen cries and then says he can be right, and stabs him in the heart as he stares at her in shock. As he collapses to the ground, the Evil Queen apologizes.

Emma goes to see Mary Margaret to reimburse the bail money. The teacher offers to hear her out and offers her cinnamon hot chocolate and cookies. Emma asks why Mary Margaret trusts her. She says she has the feeling they've met before. She believes Emma is innocent. Emma says she's leaving to keep Henry from being hurt. Mary Margaret points out the fact Emma wants to leave is the very reason to stay, because she cares about him. There'll be no one else to protect him

Henry goes to see Archie for therapy. He says he doesn't think Archie is Jiminy Cricket. Emma storms in. Archie tries to apologize for what he did, but she tells Henry she wanted to stay and get to know him. She admits she thinks the curse is crazy, but that doesn't mean it's not true. Emma told Regina what she needed to hear. The only way to break the curse is by tricking the Evil Queen into thinking they're both nonbelievers. Henry cheers up. Emma tells him the pages are dangerous, and burns them in Archie's fireplace to make sure Regina never sees them. He gets up and hugs her, saying he knew she was there to help him, and Emma says not even a curse will stop her from helping him.

The Evil Queen takes her father's heart to the clearing and tosses it into the fire. This time the curse expands throughout the land, changing everything in its path. EQ then goes to a gravestone and leaves a flower at her father Henry's grave. Henry and Emma leave Archie's office together. As Regina tends to her apple tree, Mr. Gold comes by and congratulates her on being in high spirits. When the mayor says she's triumphed, Gold warns her he saw Emma and Henry together. He suggests Regina should have come to him for help... for a price. When Regina says she's not in the business of making deals with him anymore, Gold points out he procured Henry for her and asks how she chose the name. Regina realizes Gold wanted Emma to come to Storybrooke and asks where he obtained Henry. Gold says he won't answer her questions and asks her to let him go... please. Regina stares at him in dawning realization as he walks away."
https://www.imdb.com/title/tt2011727/?ref_=ttep_ep3,,"At Henry's urging, Emma convinces Mary Margaret to pay a visit to a comatose man in the hospital and read to him from the storybook, as flashbacks show how Snow White and Prince Charming first met.",[],TV-PG,Release date,['Dean White'],"['', '', '']",[],"['bandit', 'troll', 'princess', 'apple', 'the huntsman character', 'snow white character', 'prince charming character', 'doctor victor frankenstein character', 'john doe', 'hospital', 'bridge', 'bridge troll', 'robbery', 'ring', 'wedding ring', 'black knight', 'volkswagen beetle', 'volkswagen bug', 'yellow volkswagen', 'yellow car', 'evil queen from snow white character', 'action girl', 'adoptive mother adopted son relationship', 'based on fairy tale', 'curse', 'enchanted forest', 'erased memory', 'fairy tale', 'fairy tale fantasy', 'wanted poster', 'horseback riding', 'fantasy reality crossover', 'urban fantasy', 'fantasy drama', 'teen fantasy', 'live action fantasy', 'brougham carriage', 'carriage', 'horse drawn carriage', 'horse and carriage', 'royal carriage', 'handsome prince', 'medieval fantasy', 'red jacket', 'small town sheriff', 'sheriff', 'male sheriff', 'town sheriff', '10 year old boy', '10 year old']",[],"A coach containing Prince James Charming and his fiance, Abigail, makes its way through the woods. She complains about the bumpy ride and how they should have taken the Troll Road. They come to a tree blocking the road and Prince Charming gets out to help his men move it, but realizes that it's been cut down. Meanwhile, a thief reaches into the coach, steals a package of jewels, and rides off. Prince Charming goes after the thief, knocks the person off their horse, and discovers that it's a woman. She knocks him in the head with a rock, leaving a cut on his chin, and then takes his horse, and rides off. As he watches her go, Prince James Charming vows that he'll find her no matter where she goes. Mary Margaret is at the diner chatting with her date, Dr. Whale, who is busy admiring Ruby, the waitress. When she realizes it isn't going well, Mary Margaret leaves and notices Emma Swan staying in her car on the streets because no one will give her a room. Clearly pleased that Emma stayed for Henry Mills' sake, Mary Margaret offers to let Emma stay with her, but Emma warns that she's not the roommate type.

The next day, Mary Margaret is volunteering at the hospital and notices Henry sitting with John Doe . He asks what's wrong with the patient and Mary Margaret explains that he's been there as long as she's been volunteering, and no one knows who he is or what family he has. Henry asks if she's sure she doesn't know who he is, and Mary Margaret says that she doesn't. Henry meets with Emma and tells her that she's found her father, Prince James Charming, and that he's the John Doe patient. He shows Emma the storybook and points out that Prince Charming and John Doe have the same scar on the cheek. Henry believes that the curse is keeping John Doe and Mary Margaret apart by keeping him in a coma. Emma doesn't believe it but Henry insists that they have to remind them by having Mary Margaret read the story to the coma patient. Emma agrees but says that she'll ask her. Emma then talks to Mary Margaret and suggests that she play along with Henry's idea so that he'll realize that he's wrong on his own when nothing happens. Mary Margaret admits that it's a good idea and Emma tells her that they'll meet at Granny's Diner the next day for breakfast for a full report.

Mary Margaret starts reading the fairy tale book to John Doe, telling the story of how Prince Charming chased the thief and they fell in love. As she reads, John Doe suddenly grabs her hand. She summons Dr. Whale, but he says all the instrument readings are still steady with no changes. He suggests that she might have dozed off and imagined things, and then tells her to go home and get some sleep. Once Mary Margaret leaves, Dr. Whale calls Regina Mills and tells her what happened, including the fact that Mary Margaret was involved and that there was some minor brain-wave fluctuation. At home, Mary Margaret resumes reading the story to herself.

Snow White prepares to leave her crude home in a log, taking her few possessions with her. She steps out and immediately is snagged in a trap set by Prince Charming. He demands that she return the pouch with the jewelry, but Snow White says that she sold them. She points out that he must have hundreds of jewels, but Prince Charming says that one of them was his mother's ring, which he planned to give to his fiance. Disgusted, Snow White says that it must be a marriage of convenience because no one marries for true love, and Prince Charming defends it as a necessary merger. When Snow White refuses, Prince James Charming threatens to turn her over to the Evil Queen, who has sentenced her to death for murder and treason. Snow White agrees and Prince Charming releases her.

Emma Swan meets Henry at the diner and Mary Margaret comes in to tell them that John Doe grabbed her hand. Henry is pleased and says that she has to read to him again, and Mary Margaret immediately races off, telling Emma that he may not be Prince Charming but that she must have reached him somehow. When they get to the hospital, Sheriff Graham is there and informs them that the patient has gone missing. Regina is there, looking into the matter as well, and demands to know why Emma is there. She realizes that Henry lied to her when he said he was going to the arcade. Henry wonders aloud what Regina had to do with John Doe's disappearance, and Emma points out that it's unusual that she would be there. Regina explains that she's the patient's emergency contact, after found him by the road years ago and brought him to the hospital. Emma offers to help find him, but Regina tells her to stay out of it and walks away with Henry.

Graham begins organizing the search and talks to the two employees, Leroy and Walter. They check the security tapes and Emma realizes it's the wrong tape. When they find the right one, they confirm that, four hours ago, John Doe walked out on his own into the nearby woods.

Snow White leads Prince James Charming through the woods to where she sold the jewels, and he notices her holding a necklace. She tells him not to worry about it but he snatches it away. He realizes that it's filled with dust, and she explains that it contains fairy dust that can transform an adversary into a harmless form. Prince Charming figures that she plans to use it on the Evil Queen and points out that Snow White has a lot of anger. The thief explains that the charges against her are false and that she only lived because the Queen sent the Huntsman to rip out her heart, but he took pity on her and let her go. Snow White tells Prince Charming that she only wants to get enough money to leave for another realm, and she thought the coach belonged to the Queen. They come to a stream and Snow White asks for a drink. When Prince Charming agrees, they drink and she shoves him into the water and runs off. However, the Evil Queen's Black Knight finds her and close in, and Snow White realizes that Prince Charming still has her necklace.

Graham, Emma, and Mary Margaret follow John Doe's trail. While the sheriff goes ahead, Mary Margaret asks Emma how she became a bail bondsman. Emma replies that she's been doing it as long as she can remember. When Mary Margaret pushes the issue and asks about her parents, Emma says that she never did find her parents. Henry sneaks away from his mother and comes to find them, and tells Mary Margaret that John Doe is looking for her.

The lead Black Knight prepares to kill Snow White when Prince Charming arrives and kills him with an arrow. He takes on the second knight while the third one snatches up Snow White and rides away. Prince Charming grabs an arrow and manages to shoot the knight, killing him, and Snow White rides back. She points out that he saved him and Prince James Charming says that it was the honorable thing to do. He reminds her that they need to get is jewels, and Snow White says that the trolls she sold it to are just over the next rise.

Mary Margaret doesn't believe Henry, who insists that she needs to stop and let John Doe catch up to her. Emma tells him to go home, but as Henry argues, Graham calls them over. He's found John Doe's patient tag with blood on it.

Prince Charming and Snow White arrive at the Troll Bridge and proceed on foot. The trolls climb up over the edge to surround them, and Snow White tries to negotiate for the ring. They suspect it's a setup and attack, and the lead troll has his men search Prince Charming. They find Snow White's necklace and toss it to the ground, and then find the poster for Snow White and realize who she is. Prince Charming grabs his sword and drives them back, and Snow White grabs her necklace and runs. However, the trolls grab Prince Charming and prepare to kill him. Snow White returns and uses the fairy dust to transform the trolls into insects, saving the prince but using all of the dust. He thanks her, to which she retorts with his words, that it was the honorable thing to do. They continue on with the jewels.

The group follows the trail to the old toll bridge and finds John Doe lying in the stream. They pull him out and Mary Margaret begs him to come back to them, and to her. She administers CPR and he finally revives. Looking up, he says that she saved her, while an astonished Emma looks on. John Doe admits that he doesn't know who he is, and Mary Margaret tells him that he'll be okay. They take him to the hospital and Dr. Whale works on him. A woman runs in, calling the patient ""David"", and Dr. Whale ushers her back. Regina arrives to confirm that the woman is Kathryn Nolan, the man's wife.

Prince Charming gives Snow White the gold back, and she gives him the ring. He comments that it's not her style and she tries it on. He stares at her for a moment, and then Snow White says that it isn't her style and hands it back. Prince Charming offers her the rest of the jewels, but she says that she has what she needs. He wishes her well, and says that if she needs anything... and Snow White finishes the sentiment: ""he'll always find her"". They say their goodbyes and go their separate ways. Snow White turns and looks back, hesitating for a moment, and then continuing on.

Kathryn comes over to Mary Margaret, Emma, and Henry in the hospital, thanking them for their help. She explains she and her husband were having marital problems, so she told him to leave if he didn't want to be married to her. When he left, she assumed that he left town and didn't know he'd been injured. Now Kathryn has a second chance, to say she's sorry. Dr. Whale tells everyone present that David is physically okay, but he has no memory of his past life. Dr Whale suggests that David's first instinct was to find something familiar, and Henry says he was looking for someone. As Kathryn goes to her husband, Henry goes to get his backpack and whispers to Mary Margaret that David was going to the bridge and really was looking for her, that they belong together. As Regina leaves with Henry, Emma catches up to her and points out that Kathryn's story sounds fake. She points out how convenient it is that Regina just now found Kathryn, and Regina says that after Emma went over the tapes, they checked past tapes and found out that David mentioned Kathryn's name in his sleep from time to time. The mayor tells Emma that true love won out and that thanks to Emma and Mary Margaret, the couple will now be together forever. Regina says that not having someone is the worst curse imaginable and leaves. Mary Margaret watches as Kathryn and David embrace. He looks up at her and seems to recognize her, while Mary Margaret looks at the ring that she's wearing. Later, Mary Margaret is at home when Emma arrives at her doorstep and says she wants to take her up on her offer of a spare room."
