episode_link,wiki_url,description,genres,age_rating,release_date,directors,writers,cast,tags,character_names,synopsis_with_character_names
https://www.imdb.com/title/tt7493194/?ref_=ttep_ep13,,"When The Snuggly Duckling becomes haunted by its original owner, Rapunzel helps the Pub Thugs figure out what the ghost wants.",[],TV-G,Release date,['Tom Caulfield'],"['', '', '']",[],"['portrait', 'pumpkin', 'rain', 'tuning fork', 'haunting', 'evil spirit', 'trapdoor', 'pie', 'moose head', 'curse', 'song', 'father daughter relationship', 'rapunzel character', 'rapunzel', 'disney princess', 'character name in title']",[],"It looks like we don't have any synopsis for this title yet. Be the first to contribute.
Learn more"
https://www.imdb.com/title/tt7521200/?ref_=ttep_ep14,,"A new crime-fighting horse arrives in Corona, and Maximus has found a best buddy. But it doesn't take long for Max to realize his new stable-mate didn't come to town to make nice.",[],TV-G,Release date,['Joe Oh'],"['', '', '']",[],"['chasing a thief', 'horse', 'rival', 'race', 'nightmare', 'coin', 'apple', 'two word title', 'disney princess', 'rapunzel character', 'rapunzel']",[],"It looks like we don't have any synopsis for this title yet. Be the first to contribute.
Learn more"
https://www.imdb.com/title/tt7550432/?ref_=ttep_ep15,,"When she discovers that Queen Arianna has an estranged sister, Rapunzel invites her newly discovered Aunt Willow to Corona.",[],TV-G,Release date,['Stephen Sandoval'],"['', '', '']",[],"['birthday', 'sister sister relationship', 'meteor shower', 'rattle', 'camping', 'hang glider', 'rapunzel character', 'rapunzel', 'disney princess']",[],"It looks like we don't have any synopsis for this title yet. Be the first to contribute.
Learn more"
https://www.imdb.com/title/tt7656982/?ref_=ttep_ep16,,The King and Queen leave Corona for a mountain retreat on their anniversary and place Rapunzel in charge of the kingdom. As a stand-in queen Rapunzel must face some hard decisions where she must decide to either listen to her advisors or follow her heart.,[],TV-G,Release date,['Joe Oh'],"['', '', '']",[],"['falling out of a tree', 'cat', 'vacation', 'first day on the job', 'snow', 'rescue mission', 'father daughter relationship', 'father son relationship', 'anniversary', 'legend', 'machine', 'secret passageway', 'avalanche', 'explosion', 'bridge destruction', 'cobbler the shoemaker', 'rapunzel', 'rapunzel character', 'disney princess']",[],"It looks like we don't have any synopsis for this title yet. Be the first to contribute.
Learn more"
https://www.imdb.com/title/tt7704270/?ref_=ttep_ep17,,"In the aftermath of the blizzard, Rapunzel's confidence is shaken. In an effort to get her ""mojo"" back, she rededicates herself to painting, and enrolls in an art class.",[],TV-G,Release date,['Stephen Sandoval'],"['', '', '']",[],"['art gallery', 'artwork', 'painting a picture', 'mural', 'art teacher', 'missing person', 'witch', 'spell', 'cobbler the shoemaker', 'shoe', 'two word title', 'apostrophe in title', 'apostrophe in episode title', 'shoemaker', 'disney princess', 'rapunzel character', 'rapunzel']",[],"It looks like we don't have any synopsis for this title yet. Be the first to contribute.
Learn more"
https://www.imdb.com/title/tt7704280/?ref_=ttep_ep18,,"The crotchety Griffon of Pittsford is coming to Corona because King Frederic has suggested a partnership between the two nations to keep the peace. As the Griffon is so snobby, everyone is throwing a welcoming banquet for him. This banquet is extremely important and everyone must do their part. Knowing how important the banquet is, Rapunzel, Cassandra and Eugene all t... Read all",[],TV-G,Release date,['Stephen Sandoval'],"['', '', '']",[],"['peace treaty', 'fog machine', 'potion', 'dungeon', 'picking a lock', 'rapunzel', 'disney princess', 'rapunzel character']",[],"It looks like we don't have any synopsis for this title yet. Be the first to contribute.
Learn more"
https://www.imdb.com/title/tt7704282/?ref_=ttep_ep19,,"When Rapunzel investigates a cryptic message from Varian, she finds herself on the run from a group of masked men.",[],TV-G,Release date,['Tom Caulfield'],"['', '', '']",[],"['streamer', 'nightmare', 'kite', 'birthday', 'hit with a frying pan', 'broken mirror', 'scroll', 'tower', 'rapunzel character', 'rapunzel', 'disney princess', 'character name in title']",[],"It looks like we don't have any synopsis for this title yet. Be the first to contribute.
Learn more"
https://www.imdb.com/title/tt7704284/?ref_=ttep_ep20,,"Rapunzel is very upset when she finds out her father lied about the Black Rocks and later has a dream where King Frederic apologizes and they have a father-daughter dance, but are interrupted when the Black Rocks spring from the ground and grow all over the room. As the rocks rapidly multiply, Varian appears and tells her to face her destiny. After waking up, she goes... Read all",[],TV-G,Release date,['Joe Oh'],"['', '', '']",[],"['father daughter relationship', 'scroll', 'tunnel', 'booby trap', 'spider', 'automaton', 'nightmare', 'rapunzel', 'disney princess', 'rapunzel character']",[],"It looks like we don't have any synopsis for this title yet. Be the first to contribute.
Learn more"
https://www.imdb.com/title/tt7729280/?ref_=ttep_ep21,,"When the kingdom of Corona is threatened on Princess Rapunzel's 19th birthday, King Frederic prioritizes the personal safety of his daughter over the safety of the whole kingdom. Rapunzel must overcome the king's overprotectiveness in order to save everything and everyone she loves.",[],TV-G,Release date,['Stephen Sandoval'],"['', '', '']",[],"['birthday', ""covering someone's eyes with one's hands"", 'birthday present', 'stable', 'automaton', 'banner', 'father daughter relationship', 'accordian', 'raccoon', 'trampoline', 'kidnapping', 'disney princess', 'rapunzel character', 'rapunzel']",[],"It looks like we don't have any synopsis for this title yet. Be the first to contribute.
Learn more"
https://www.imdb.com/title/tt2312764/?ref_=ttep_ep1,,"Sherlock Holmes, fresh out of rehab, is teamed with a sobriety partner, a former surgeon named Watson. They have to learn to work together even as they tackle their first case, the mysterious death of a doctor's wife.",[],TV-14,Release date,['Michael Cuesta'],"['', '']",[],"['one word title', 'pacifier behaviour', 'non haptic communication', 'serial killer', 'therapy']",[],"""Elementary"" - ""Pilot"" - Sept. 27, 2012

In slow motion, a glass drops and shatters, a red haired woman is pursued through a house, up a staircase, and into a bedroom. On the bed she struggles to reach for something behind the lamp.

Sherlock Holmes (Jonny Lee Miller) is fresh out of rehab and all tatted up. He has been given an ultimatum by his wealthy father: stay sober and he can stay in the rundown--but still fabulous-- brownstone in NYC that his father owns. (It is one of many and not the best but still, a fabulous brownstone.)

His father has hired Joan Watson (Lucy Liu) as his sober companion. She is a whipsmart former surgeon, who, we learn through Holmes' deductions and Google skills, lost a patient and subsequently her medical license.

Holmes, quirky to say the least, wants no part of this sober companionship. When she first arrives he is watching a whole bunch of televisions in his house. He stops Watson dead in her tracks with a serious, eye-to-eye declaration about true love at first sight. He then clicks one of the paused TVs and reveals he has just repeated verbatim a schmaltzy monologue from a soap. She's so flustered she drops her purse, which will be important later.

She says his dad hired her and where he goes, she goes, but he can introduce her however he wants to protect his sobriety anonymity. So off they go, naturally, to a crime scene where he introduces her to police captain Gregson (Aidan Quinn) as his ""valet."" Gregson explains to Watson that when he was in London doing some post-9/11 stuff, Holmes was helping Scotland Yard as a consultant and his sleuthing skills blew Gregson away. Now that Holmes is in NYC they plan to use his services.

The case is a missing woman reported by her husband. It looks like the door was kicked in, there are glass shards in the kitchen, and there was a struggle in the bedroom. This is the home of the red-haired woman. Holmes deduces she knew her attacker because there were two broken glasses-- something overlooked by the police-- and the blood in the footprint on the door shows it was left afterward by someone who wanted it to look like it was busted down. Holmes also figures out that there was a panic room in the house. He finds the button behind the lamp and it reveals the red-haired woman lying in a pool of blood, dead on the floor. The husband, apparently, didn't know about the panic room.

The husband, of course, is questioned at first but his feet are too small for the footprint and his hand too small to have left the choking marks around his wife's neck. (A fact confirmed by former doctor Watson in a show of observation that Holmes clearly appreciates.)

Together the pair chase down more leads and come upon a flower delivery man who they think might be a serial killer attracted to red-haired women. Once it looks like they've got it all sewn up, the flower guy turns up dead of an apparent suicide and his cell phone is missing. At his house, a washing machine is turned over with clothes spilling out of it, and a glance at his pantry includes a bag of rice on the door.

The cops still think they have their guy but it's not sitting right with Holmes. The flower guy had been going to see a psychiatrist and recording his sessions. Then his shrink died and there is no record of seeing another doctor even though it was clear the flower guy was very disturbed. Holmes begins to suspect the husband again because he is also a psychiatrist and the flower guy was obsessed with redheads. He notices that the wife had once been a pretty blonde with a mole but when she died she was a flaming redhead who had undergone extensive plastic surgery.

Meanwhile, Holmes is trying to put off Watson by dimestore psychoanalyzing her past, unplugging her alarm clocks, and basically saying he will pay her to go away. He pisses her off so much at one point that she leaves to go to an opera she had planned for them to attend together. Full of new revelations, Holmes shows up, is generally a loud pain in the ass, and convinces her to leave to continue work on the case.

Holmes and Watson confront the husband again and Holmes lays out his theory that he wanted to off his very wealthy wife but couldn't do it himself. He had been treating flower guy who was obsessed with redheads and violent. So he started making his wife get plastic surgery and dye her hair. He started ordering flowers for her every week so the flower guy would see her and become obsessed. Instead of prescribing sedatives, he gave him steroids to agitate him. He basically made the guy into a loaded weapon aimed at his wife. The smug doctor basically admits this is true but knows Holmes has no evidence so he blows him off. Holmes promptly gets into Watson's car and rams the doctor's fancy sports car and is arrested.

When Watson comes to see him in jail he apologizes for wrecking her car and generally being an ass. She asks him what happened in London that sent him to rehab. He answers that it's a false premise that if she knows something personal about him that they will be closer. She notes that he has very few mirrors in his house, she thinks this is because he knows a lost cause when he sees one.

The next day they confront the doctor in Gregson's office. Holmes breaks it down: when he saw the overturned washer and noticed the missing cell phone he realized what happened. When Watson noticed the bag of rice in his pantry, even though she saw in his medical records that he was allergic to rice, she helped put two and two together. The flower guy accidentally washed his cell phone, ruining it. In a rage he overturned the washer. He then went to the store and bought some rice, which can act as a dessicant and save waterlogged electronics. Holmes produces the phone and hits a button: out comes the sound of a therapy session that flower guy recorded with the smug doctor as his shrink. Bullseye.

Later, back at the brownstone Holmes and Watson are planning to go to dinner but Watson wants to finish watching the Mets game. Holmes succinctly predicts how the last three at bats are going to go and how the game will end with a double play and says he'll wait for her downstairs. The game then ends precisely this way much to Watson's aggravation. They head out to dinner."
https://www.imdb.com/title/tt2331654/?ref_=ttep_ep2,,"Two heirs of a fortune are murder suspects, but one sister has an undeniable alibi and the other is a coma patient. Holmes is baffled as to how a coma patient could be the killer until another addict in his support group gives him an idea.",[],TV-14,Release date,['John David Coles'],"['', '']",[],"['four word title', 'villainess', 'theft', 'medical examination', 'therapy', 'in laws', 'false identity', 'dna testing']",[],"""Elementary"" - ""While You Were Sleeping"" - Oct. 4, 2012

Holmes and Watson are at an AA-type meeting with a man sharing. When Watson notices Holmes zoned out she touches his shoulder and he jumps up shouting ""Amygdala!""

Turns out he's not into the whole 12 step thing, or really anything crowding his brain he doesn't deem ""necessary"" information so he puts himself in a trance when confronted with the unnecessary. He does this by internally chanting a mantra: amygdala.

They get a call from Gregson and head to the crime scene. A man has been shot in the head in an apartment building. He's a cop's brother so they have their best people on it including a young detective named Bell. They believe it was a robbery homicide. But with a few quick glances Holmes deduces it was a robbery AND a homicide committed by two different people.

He figures the robbery was done by a strong man because he notices a piece of furniture missing. He pins it quickly on the neighbor who called 911. The shooter on the other hand is still unknown but Holmes, after sniffing the chair where the shot originated, realizes it was a woman based on the remnant fragrances of her deodorant.

Back at the precinct house Bell is trying to get the neighbor to cop to the murder but he won't. And of course it's because he isn't the shooter as Holmes points out again to Gregson. He gets heated and Watson sends him to get some chips. She asks Gregson if he was like this before in London. Gregson says he was a pain in the ass but really good. He also notes that Holmes called him recently to get back to work, saying he was calling from Heathrow. Watson notes this.

Bell joins them and Holmes argues that a sketch artist should be brought in since the neighbor says he passed a woman on the stairs. Bell protests saying the neighbor overheard ""Harry Potter"" (Holmes) mention a woman and made it up. Gregson asks for one anyway saying Holmes might be wrong but he wants to check it out.

On their way out Watson says she's meeting a friend and Holmes deduces it's a male friend that is probably an ex that she might sleep with. He tells her she should since it will improve her mood.

Turns out Holmes was right as Watson meets with her ex, Ty, an assistant district attorney. He misses her and worries about her babysitting drug addicts and says if she's doing it as penance for losing a patient, she shouldn't. She says she does it because she's good at it. He notes her parents have reached out said she isn't returning their calls. She says she doesn't want to be lectured all the time.

The next morning Holmes notices on the autopsy that the dead guy had a special genetic condition that clouded his cornea. Watson wonders why it's relevant and Holmes says why not?

Bell calls them to a hospital. He has found the woman from the sketch. Unfortunately, she's been in a coma for three days having tried to commit suicide so she couldn't have killed the dead guy. Bell thanks Holmes for his help and says he'll take it from here.

Watson and Holmes stay behind to make sure the woman isn't faking. She isn't. But Holmes deduces that she has a twin thanks to the inscription on a book by her bed. They track down the twin but it's a dead end because she's fraternal.

Later at home, as Holmes practices lock picking, Watson unearths an old violin and encourages him to play as a form of therapy. He doesn't want to. She gets a call from Ty. As she answers, Holmes puts the violin in a trash can and sets it on fire. Watson, alarmed, throws a blanket over it but her ex is confused.

Holmes gets a call from Gregson and they head to another scene. A woman shot in the head with the same gun, by a seated shooter wearing the same deodorant. They also notice she has the same genetic corneal issue. Through DNA they figure out the first dead guy and the woman were half siblings with the same father. They didn't know each other and their families didn't know about them. Their mothers are dead and the families aren't helping.

Holmes, Watson, Bell and Gregson run down an investigator who was following the girl. Turns out Gregson knows him from their old days in the department. He says he can't tell them anything because it's to do with a case. Holmes pulls the guy out of the room and says he can tell he's been taking methamphetamines to stay awake and that his stash is nearby so unless he wants to get busted by the police he better help. The guy decides to simple ""leave this file"" on his desk and go to the bathroom.

Holmes and the gang head back to the fraternal twin who hired the detectives to investigate the victims. Turns out the victims were sired out of wedlock by the twins' dad and stood to inherit a fortune. Holmes theorizes the sisters had them investigated to figure out how to kill them. The woman says they only wanted to find out what kind of people they were, but before she and her sister could decide what to do her sister tried to commit suicide. Holmes implies that she tried to kill her sister to get even more of the inheritance. She slaps him and says she'd never hurt her sister. Bell and Gregson take her away but Holmes asks one more question: why go to all the trouble of dressing up like her sister, wig, deodorant, make-up to commit the crimes? She says he's insane.

They return to the brownstone and find Ty waiting for them with a bottle of wine in hand. He says Watson emailed him to come to the house for a dinner party. She shoos him off. Holmes hacked her email. He throws back in her face what she said about opening up to each other. He tells her smirkingly they don't have to be friends, they just have to get through the next five weeks and go their separate ways.

Watson drags Holmes to another meeting. But this time he listens, and as a woman shares about having an affair with a married doctor and using him to get drugs, Holmes has an epiphany. He charges out and Watson wants to know what's up. He says there isn't time. She says maybe they won't be friends but they need to trust each other so he has to let her in a bit.

They go to coma twin's hospital room and the other twin is reading to her. Holmes calls the awake twin a murderer and claims there is a third half sibling she didn't know about but that he will be protecting her himself at the address that he gives with her name. He then shoves Bell, who arrests him.

At the address Holmes gave, a woman is returning home. Someone else follows behind her into the house. As she's about to attack the police swoop in. It was all a trap of course. But the twist is that

it's coma sister holding the gun.

At the precinct Holmes explains that he realized coma sister enlisted her doctor for help. When they learned of the other heirs and her sister wanted to share, the doctor and coma sister came up with this elaborate plan: suicide attempt, coma to cover their tracks. He kept her in a medically induced coma when he wasn't around to fool everyone and woke her up to commit the murders. Awake sister wants to help coma sister even though she's a murderer. Holmes points out an important detail: why was coma sister still in a coma? She had killed all the heirs they knew about. Ah; that's right, she was going to kill her own sister. Oh, snap.

Case closed, Bell offers sincere thanks and Gregson invites Holmes and Watson for a drink. He takes a raincheck.

Back at the brownstone, over take out, Watson points out that Holmes listening in the meeting actually helped crack the case. He grudgingly thanks her. She asks if he ever thinks what he's doing is a form of penance without even knowing it. He says you have to know it, otherwise it isn't penance.

Later that night, while Watson is in bed upstairs, Holmes unearths another violin and begins to play."
