episode_link,wiki_url,description,genres,age_rating,release_date,directors,writers,cast,tags,character_names,synopsis_with_character_names
https://www.imdb.com/title/tt2117632/?ref_=ttep_ep22,,"After Faye is attacked by the Witch Hunters, Jake, Melissa and Adam set out to save her. Blackwell tells Cassie and Diana that the only way to stop the Witch Hunters is to use their Balcoin blood to unleash the Crystal Skull. Diana is reluctant, but Cassie convinces her its the only way to help their friend, but she'll need to tap into her dark magic to do it. Meanwhi... Read all",[],TV-14,Release date,['David Barrett'],"['', '', '']",[],"['kiss', 'execution', 'ritual', 'paternity', 'transformation', 'explosion', 'kidnapping', 'fire', 'bare chested male', 'series finale']",[],"Diana wakes up in Grant's car. She's been asleep for two hours and getting texts about Faye and Eben. Grant offers to take her away from everything and she loves the idea, just not right now.

Faye gets roughed up by the witch hunters on the ferry.

Back at the house, they suggest calling Blackwell. Diana is against it, but they think they need help. Sam only had one demon in him and they couldn't stop him; Eben has six.

Eben calls on Faye's phone. He tells Cassie to bring one crystal to the boat. Adam is all for it. But they wonder if Blackwell was telling the truth about the skull being the only way to kill Eben, since he wants one so they can't form it.

Cassie and Diana would have to be there to put it together because of their Balcoin blood.

Adam wants a back-up plan. Cassie suggests they figure out how to deal with Blackwell after Faye is safe.

Dawn goes to Charles. He tells her about reliving what he did to Amelia when he killed her. She tells him about Blackwell wanting to destroy him; he knows it worked because he confessed to Diana.

They think they have to get their powers back to help the circle and there's only one person who can make that happen.

Cassie and Diana find Blackwell while the others go to the ferry where their parents died.

Blackwell tells them to create the skull they have to destroy each crystal and let them reform. When they do that, their powers won't be connected to the crystals or each other. ""Which means your circle will be unbound,"" he says.

Diana doesn't want to unbind the circle without talking with the others. But Cassie says they don't have a choice if they want to save Faye.

Blackwell gets started, lighting the crystals. He tells Diana and Cassie to each take two. They toss them into the lake and wait for the skull to come to them.

At the ferry, Jake wants to charge in. They all feel a pang in their chest. Jake wants to see if Faye is OK, but Adam stops him with magic. He realizes it's solo magic and the circle is unbound.

On the boat, Faye discovers her magic works and gets free. She beats up on a witch hunter to get her phone.

Charles' mother arrives at his house.

Faye calls her mom. She tells her mom she knows she's a witch, but Dawn already knows. She tells her mom where she is but that she can't get out because there are witch hunters everywhere.

Charles' mom tells him their power was destroyed when they stripped it and it can't be restored, so instead she's going to give them hers.

The water starts bubbling in the lake and Cassie feels the skull forming. She walks in and gets it from the roiling, frothy water.

Blackwell shouts at her to pick it up while it's still forming. She picks it up and gets a charge from it. She carries it out and says the power is amazing.

Diana puts her hands on it and Blackwell tells them whatever happens, don't remove their hands. The big blob shrinks down into a crystal skull.

Melissa, Adam and Jake can't reach Cassie and wonder what's going on. Adam goes for Cassie and Diana.

Blackwell takes the skull from Cassie, she wants to know why she can't hold it. She's mesmerized by it and takes it back from Blackwell. She asks why she can't be the one to use it on Eben. Diana votes for that plan. Blackwell knocks them out and takes the skull.

Charles' mom finishes turning over her powers. Charles asks her for her help.

Jake and Melissa sneak onto the ferry. They find Faye but Eben finds them. He paralyzes them. ""Time to die,"" he says.

Cassie and Diana wake up in the abandoned house. They try to sneak off but they're trapped in a force field. Blackwell says he needs them there and tells them everything he's doing is so they can be the witches they were meant to be.

Eben has Faye, Melissa and Jake tied to a pole. He lights a fire in a circle around them. It quickly spreads. Charles and Dawn arrive.

They see Eben watching the kids in the fire. Charles tells Dawn he'll handle Eben. Charles starts reciting something that brings Eben to his knees and forces the demons out.

Dawn puts out the fire with magic and frees the kids. Charles keeps chanting and lets the demons crawl into him.

Jake splits off to go after Eben. Eben tells Charles it isn't over. ""It is for you,"" Jake says. He stabs him, for his parents and Nick. He looks up and Charles is gone.

Back at the house, Cassie realizes Blackwell never planned on killing Eben. He sent their parents off to the ferry 16 years ago so the circle would be easy-to-manipulate orphans.

Dawn, Melissa and Faye see Charles on the ferry deck. She sees the demons in him and asks what he's done. He manages to tell her to tell Diana he loves her, then he pitches over the side of the ferry into the water.

In the house, John recites a spell. Cassie asks what his plan is if he's not using the skull on witch hunters. ""To kill witches, every single one without Balcoin blood,"" he says as he reveals the Balcoin emblem on his palm.

On the ferry, the women feel a burning inside.

Adam comes to the house, also feeling the pain, in time to hear Blackwell say he wants to get rid of weak witches and gather the other Balcoin children -- four in other towns, raised in other circles. They're coming to join Cassie and Diana. He calls them the purest race.

""We'll destroy the witch hunters once and for all. We can change the world, as a family,"" he says.

Adam slowly moves the table with the skull toward him with magic as Blackwell's back is turned, but he's weak. Blackwell sees him and throws him across the room. They see Adam is burning.

Cassie tries to use her dark magic to break free, but she's not strong enough. She tells Diana she needs her power. Diana sinks to her knees as Cassie chokes her to death. It ignites Diana's dark magic and the force field is broken. Cassie grabs the skull and tries to reverse his spell. She's not strong enough on her own, but Diana joins her and using the skull they take on Blackwell.

They're stronger than he is. He sinks to his knees and starts to turn to ash, protesting that they're the same blood. They kill him.

The circle comes to Cassie's house.

She tells them she should have known Blackwell was up to no good and is sorrier than they'll ever know. They can't destroy the skull, so they suggest putting it in a lead box and dumping it in the ocean. They nominate Adam the reliable one for the job.

They debate binding the circle again. People only started coming after them when they bound it. Faye says they're connected even if they're not bound.

Cassie reminds them other Balcoins are coming and binding their circle is their best protection. Diana, who hasn't said anything yet, says she's leaving town and can't bind the circle.

Cassie pleads with her to stay, but Diana wants to get away from everything. Cassie commends Charles for saving them all, but Diana says he also did some terrible things. But with Charles gone, she has nothing left. And after feeling her dark magic when Cassie activated it, she never wants to feel it again. Diana leaves.

Jake offers to take Faye home, but she plays hard to get, saying she has plans. He kisses her.

Diana meets up with Grant at the coffee shop with her bags.

Melissa comes home to find Faye prepping for a big night out. It's Sunday night, but they have solo magic and can make their own fun.

At his place, Jake finds a note from his grandfather, saying the circles are coming together and the fight is far from over. There's a small vial of granules with it.

Charles sits in a chair as his mother makes a mark on his arm. Reliable Adam tries out the crystal skull and likes the rush. Driving off with Grant, Diana sees that she has the Balcoin mark on her palm. At home alone, Cassie lights fires with hers.

Four teenagers with Balcoin marks on their palms look out over Chance Harbor."
https://www.imdb.com/title/tt0739855/?ref_=ttep_ep1,,,,,,,,,,,
https://www.imdb.com/title/tt0739867/?ref_=ttep_ep2,,,,,,,,,,,
https://www.imdb.com/title/tt0739868/?ref_=ttep_ep3,,,,,,,,,,,
https://www.imdb.com/title/tt0739858/?ref_=ttep_ep4,,,,,,,,,,,
https://www.imdb.com/title/tt0739860/?ref_=ttep_ep5,,,,,,,,,,,
https://www.imdb.com/title/tt0739864/?ref_=ttep_ep6,,,,,,,,,,,
https://www.imdb.com/title/tt0739859/?ref_=ttep_ep7,,,,,,,,,,,
https://www.imdb.com/title/tt5867122/?ref_=ttep_ep1,,"When a vivacious young escort, Shannan Gilbert, vanishes on Long Island's south shore in 2010, her disappearance leads police to discover the bodies of ten other victims dumped by a serial killer.",[],TV-14,Release date,['Stephen Schuster'],"['', '', '']",[],[],[],"It looks like we don't have any synopsis for this title yet. Be the first to contribute.
Learn more"
https://www.imdb.com/title/tt5867128/?ref_=ttep_ep2,,"The discovery of four women's bodies on Gilgo Beach was just the beginning. But who is the Long Island Serial Killer? Investigators uncover multiple suspects and shocking theories, as they race to capture this prolific killer before he strikes again.",[],TV-14,Release date,['Stephen Schuster'],"['', '', '']",[],[],[],"It looks like we don't have any synopsis for this title yet. Be the first to contribute.
Learn more"
https://www.imdb.com/title/tt5867140/?ref_=ttep_ep3,,"In 2011, a 10-month-old baby girl goes missing from her home in Kansas City. The family fears she's been kidnapped by a drifter, only to be accused by the police of being responsible for her disappearance.",[],TV-14,Release date,['Stephen Schuster'],"['', '', '']",[],[],[],"It looks like we don't have any synopsis for this title yet. Be the first to contribute.
Learn more"
https://www.imdb.com/title/tt5867150/?ref_=ttep_ep4,,Outgoing Jackie Galloway is found strangled and bound with ritualistic knots. Police investigate suspects in her inner circle but are shocked when a chance encounter with a prowler leads them to discover the murderer is a budding serial killer.,[],TV-14,Release date,['Stephen Schuster'],"['', '', '']",[],[],[],"It looks like we don't have any synopsis for this title yet. Be the first to contribute.
Learn more"
https://www.imdb.com/title/tt5840712/?ref_=ttep_ep5,,"A mother and three teens are murdered in the remote town of Keddie, California. Despite a trail of suspects and illicit activity, no one was ever brought to justice. But recently discovered evidence may be the key to finally cracking case.",[],TV-14,Release date,"['Thomai Hatsios', 'Stephen Schuster']","['', '', '']",[],[],[],"It looks like we don't have any synopsis for this title yet. Be the first to contribute.
Learn more"
https://www.imdb.com/title/tt5867162/?ref_=ttep_ep6,,"In 2012, hikers in Los Angeles' Hollywood Hills discover the severed head of Hervey Medellin, a retired flight clerk. The cast of suspects includes former lovers, drug cartels and a murderous porn star, in a tale of lust, greed and butchery.",[],TV-14,Release date,['Stephen Schuster'],"['', '', '']",[],[],[],"It looks like we don't have any synopsis for this title yet. Be the first to contribute.
Learn more"
https://www.imdb.com/title/tt5867168/?ref_=ttep_ep7,,"In 1995, 16-year-old Adrianne Jones is found shot to death in Grand Prairie, Texas. A model student and athlete, there seems to be no reason for her death. Police investigate boyfriends, neighbors and local troublemakers, but don't have any strong suspects. The case grows cold, until nine months later when a game of Truth-or-Dare leads to a startling confession and an... Read all",[],TV-14,Release date,['Stephen Schuster'],"['', '', '']",[],[],[],"It looks like we don't have any synopsis for this title yet. Be the first to contribute.
Learn more"
https://www.imdb.com/title/tt5974700/?ref_=ttep_ep8,,"Six-year-old beauty queen JonBenet Ramsey is found murdered in her Boulder, Colorado home in 1996. Investigators try to unravel if she was killed in a kidnapping-gone-wrong, by a home intruder or by one of her own family.",[],TV-14,Release date,"['Thomai Hatsios', 'Stephen Schuster']","['', '', '']",[],[],[],"It looks like we don't have any synopsis for this title yet. Be the first to contribute.
Learn more"
https://www.imdb.com/title/tt5867174/?ref_=ttep_ep9,,"A lone survivor is the only witness who can help police track down a serial killer known as the Grim Sleeper, who preys on women in South Central Los Angeles. After decades of searching, police hone in on an unlikely suspect.",[],TV-14,Release date,"['Thomai Hatsios', 'Stephen Schuster']","['', '', '']",[],[],[],"It looks like we don't have any synopsis for this title yet. Be the first to contribute.
Learn more"
https://www.imdb.com/title/tt6960888/?ref_=ttep_ep10,,"In 2004, the small town of Craig, Alaska is shocked when police discover the charred body of beloved mother and wife Lauri Waterman. People have no idea who would want to kill her, until an unlikely witness reveals a sordid story of secrets and lies.",[],TV-14,Release date,['Stephen Schuster'],"['', '', '']",[],[],[],"It looks like we don't have any synopsis for this title yet. Be the first to contribute.
Learn more"
https://www.imdb.com/title/tt6046144/?ref_=ttep_ep11,,"An army surgeon, Jeffrey MacDonald, is the lone survivor of a brutal 1970 home invasion that claims the lives of his wife and daughters. But authorities doubt his story of murderous hippies and believe MacDonald is the culprit.",[],TV-14,Release date,['Stephen Schuster'],"['', '', '']",[],[],[],"It looks like we don't have any synopsis for this title yet. Be the first to contribute.
Learn more"
https://www.imdb.com/title/tt5021510/?ref_=ttep_ep1,,"The grand opening of Chicago Med's emergency department is interrupted by victims of an elevated train crash, pushing the staff to their limits.",[],TV-14,Release date,['Michael Waxman'],"['', '', '']",[],[],[],"It looks like we don't have any synopsis for this title yet. Be the first to contribute.
Learn more"
https://www.imdb.com/title/tt5086038/?ref_=ttep_ep2,,Ethan finds himself at odds with Natalie and Sharon as he treats a teenage mother who abandoned her newborn baby in an alley.,[],TV-14,Release date,['Fred Berner'],"['', '', '']",[],"['abbreviation in title', 'baby found in knapsack', 'teenage mother', 'reference to connie francis', 'dementia', 'hydrocephalus', 'escaped patient', 'heart attack', 'baby shower']",[],"It looks like we don't have any synopsis for this title yet. Be the first to contribute.
Learn more"
https://www.imdb.com/title/tt5122700/?ref_=ttep_ep3,,Connor is forced to confront his past when he takes on the case of a close family friend who's been impaled by glass shards.,[],TV-14,Release date,['Tara Nicole Weyr'],"['', '', '']",[],"['chandelier', 'impalement', 'hit by a falling chandelier', 'musician', 'reference to niccolo paganini', 'reference to johann sebastian bach', 'diabetic', 'army ranger', 'reference to kandahar', 'acoustic neuroma', 'prednisone', 'violinist', 'reference to anne sophie mutter', 'title directed by female']",[],"It looks like we don't have any synopsis for this title yet. Be the first to contribute.
Learn more"
https://www.imdb.com/title/tt5143822/?ref_=ttep_ep4,,"In the aftermath of a movie theater shooting, the doctors work to treat the victims while Sharon tries to keep the press at bay.",[],TV-14,Release date,['Donald Petrie'],"['', '', '']",[],"['shooting', 'movie theater', 'shooting in movie theater', 'reference to twitter', 'reference to kalashnikov rifle', 'reference to a m 16 rifle', 'malcolm x quote', 'quote from confucius', 'prank gone wrong', 'kicked in the head', 'organ transplant', 'reference to a tic tac', 'domineering mother', 'reference to the internet', 'racist', 'casual racism', 'superior mesenteric artery', 'digestive disorder', 'suicide', 'reference to sarcoidosis', 'bigot', 'genetic test', 'feeding tube', 'bare chested male', 'reference to crusades', 'reference to the mongol conquest', 'reference to world war one', 'man wears eyeglasses', 'woman wears black lingerie', 'reference to world war two']",[],"It looks like we don't have any synopsis for this title yet. Be the first to contribute.
Learn more"
https://www.imdb.com/title/tt5230572/?ref_=ttep_ep5,,"As Doctors Rhodes and Zanetti race against the clock to save a fallen member of Firehouse 51, the case of a woman clinging to life is discovered to be similar to those of other patients.",[],TV-14,Release date,['Nick Gomez'],"['', '', '']",[],"['crossover episode', 'meet cute', 'rooftop', 'gunshot wound', 'interracial kiss', 'kiss in elevator', 'chemotherapy', 'misdiagnosis', 'suicide attempt', 'lesbian couple', 'birthing class', ""character says let's get out of here"", 'kidney failure']",[],"It looks like we don't have any synopsis for this title yet. Be the first to contribute.
Learn more"
https://www.imdb.com/title/tt5230566/?ref_=ttep_ep6,,Sharon is visited by the Department of Homeland Security regarding two airplane stowaways who are brought to the hospital with major injuries.,[],TV-14,Release date,['Michael Waxman'],"['', '', '']",[],[],[],"It looks like we don't have any synopsis for this title yet. Be the first to contribute.
Learn more"
https://www.imdb.com/title/tt5261676/?ref_=ttep_ep7,,Sharon must decide whether to put her job on the line for a patient in need.,[],TV-14,Release date,['Jann Turner'],"['', '', '']",[],"['reference to mother teresa', 'reference to st. francis', 'elbow injury', 'transplant', 'stroke victim', 'brain lesion', 'reference to mahatma gandhi']",[],"It looks like we don't have any synopsis for this title yet. Be the first to contribute.
Learn more"
https://www.imdb.com/title/tt5257324/?ref_=ttep_ep8,,"A Saudi prince arrives for a surgical procedure, while Dr. Manning returns from maternity leave and treats a teen with a long history of medical issues.",[],TV-14,Release date,['Donald Petrie'],"['', '', '']",[],[],[],"It looks like we don't have any synopsis for this title yet. Be the first to contribute.
Learn more"
https://www.imdb.com/title/tt5355270/?ref_=ttep_ep9,,Dr. Halstead jeopardizes his career when he goes against a family's orders and revives a terminally ill cancer patient.,[],TV-14,Release date,['Jean de Segonzac'],"['', '', '']",[],[],[],"It looks like we don't have any synopsis for this title yet. Be the first to contribute.
Learn more"
https://www.imdb.com/title/tt5431758/?ref_=ttep_ep10,,Doctors Rhodes and Downey set aside their differences to operate on a 9/11 hero with pulmonary fibrosis.,[],TV-14,Release date,['Fred Berner'],"['', '', '']",[],[],[],"It looks like we don't have any synopsis for this title yet. Be the first to contribute.
Learn more"
https://www.imdb.com/title/tt5446338/?ref_=ttep_ep11,,,,,,,,,,,
https://www.imdb.com/title/tt5475660/?ref_=ttep_ep12,,,,,,,,,,,
https://www.imdb.com/title/tt5517936/?ref_=ttep_ep13,,,,,,,,,,,
https://www.imdb.com/title/tt5601236/?ref_=ttep_ep14,,,,,,,,,,,
https://www.imdb.com/title/tt5601240/?ref_=ttep_ep15,,,,,,,,,,,
https://www.imdb.com/title/tt5601242/?ref_=ttep_ep16,,,,,,,,,,,
https://www.imdb.com/title/tt5601244/?ref_=ttep_ep17,,,,,,,,,,,
https://www.imdb.com/title/tt5601246/?ref_=ttep_ep18,,,,,,,,,,,
https://www.imdb.com/title/tt0674826/?ref_=ttep_ep1,,,,,,,,,,,
https://www.imdb.com/title/tt0674828/?ref_=ttep_ep2,,,,,,,,,,,
https://www.imdb.com/title/tt0674827/?ref_=ttep_ep3,,,,,,,,,,,
https://www.imdb.com/title/tt0674832/?ref_=ttep_ep4,,,,,,,,,,,
https://www.imdb.com/title/tt0905103/?ref_=ttep_ep5,,,,,,,,,,,
https://www.imdb.com/title/tt0905102/?ref_=ttep_ep6,,,,,,,,,,,
https://www.imdb.com/title/tt0674825/?ref_=ttep_ep7,,,,,,,,,,,
https://www.imdb.com/title/tt1001012/?ref_=ttep_ep0,,,,,,,,,,,
https://www.imdb.com/title/tt0782363/?ref_=ttep_ep1,,,,,,,,,,,
https://www.imdb.com/title/tt0905807/?ref_=ttep_ep2,,,,,,,,,,,
https://www.imdb.com/title/tt0942601/?ref_=ttep_ep3,,,,,,,,,,,
https://www.imdb.com/title/tt0942577/?ref_=ttep_ep4,,,,,,,,,,,
https://www.imdb.com/title/tt0942576/?ref_=ttep_ep5,,,,,,,,,,,
https://www.imdb.com/title/tt0942604/?ref_=ttep_ep6,,,,,,,,,,,
https://www.imdb.com/title/tt0942567/?ref_=ttep_ep7,,,,,,,,,,,
https://www.imdb.com/title/tt0942590/?ref_=ttep_ep8,,,,,,,,,,,
https://www.imdb.com/title/tt0818020/?ref_=ttep_ep9,,,,,,,,,,,
https://www.imdb.com/title/tt0619442/?ref_=ttep_ep10,,,,,,,,,,,
https://www.imdb.com/title/tt0905809/?ref_=ttep_ep11,,,,,,,,,,,
https://www.imdb.com/title/tt0942572/?ref_=ttep_ep12,,,,,,,,,,,
https://www.imdb.com/title/tt0942580/?ref_=ttep_ep13,,,,,,,,,,,
https://www.imdb.com/title/tt0873064/?ref_=ttep_ep14,,,,,,,,,,,
https://www.imdb.com/title/tt0942600/?ref_=ttep_ep15,,,,,,,,,,,
https://www.imdb.com/title/tt0942591/?ref_=ttep_ep16,,,,,,,,,,,
https://www.imdb.com/title/tt0942605/?ref_=ttep_ep17,,,,,,,,,,,
https://www.imdb.com/title/tt1325221/?ref_=ttep_ep18,,,,,,,,,,,
https://www.imdb.com/title/tt0942596/?ref_=ttep_ep19,,,,,,,,,,,
https://www.imdb.com/title/tt0942599/?ref_=ttep_ep20,,,,,,,,,,,
https://www.imdb.com/title/tt0942598/?ref_=ttep_ep21,,,,,,,,,,,
https://www.imdb.com/title/tt0942583/?ref_=ttep_ep22,,,,,,,,,,,
https://www.imdb.com/title/tt0922026/?ref_=ttep_ep23,,,,,,,,,,,
https://www.imdb.com/title/tt0942585/?ref_=ttep_ep24,,,,,,,,,,,
https://www.imdb.com/title/tt0942571/?ref_=ttep_ep25,,,,,,,,,,,
https://www.imdb.com/title/tt0942560/?ref_=ttep_ep26,,,,,,,,,,,
https://www.imdb.com/title/tt2707612/?ref_=ttep_ep1,,,,,,,,,,,
https://www.imdb.com/title/tt2707618/?ref_=ttep_ep2,,,,,,,,,,,
https://www.imdb.com/title/tt2707626/?ref_=ttep_ep3,,,,,,,,,,,
https://www.imdb.com/title/tt2761112/?ref_=ttep_ep4,,,,,,,,,,,
https://www.imdb.com/title/tt2767132/?ref_=ttep_ep5,,,,,,,,,,,
https://www.imdb.com/title/tt2793074/?ref_=ttep_ep6,,,,,,,,,,,
https://www.imdb.com/title/tt0528639/?ref_=ttep_ep1,,,,,,,,,,,
https://www.imdb.com/title/tt0528640/?ref_=ttep_ep2,,,,,,,,,,,
https://www.imdb.com/title/tt0528630/?ref_=ttep_ep3,,,,,,,,,,,
https://www.imdb.com/title/tt0528626/?ref_=ttep_ep4,,,,,,,,,,,
https://www.imdb.com/title/tt0528600/?ref_=ttep_ep5,,,,,,,,,,,
https://www.imdb.com/title/tt0528614/?ref_=ttep_ep6,,,,,,,,,,,
https://www.imdb.com/title/tt0528610/?ref_=ttep_ep7,,,,,,,,,,,
https://www.imdb.com/title/tt0528622/?ref_=ttep_ep8,,,,,,,,,,,
https://www.imdb.com/title/tt0528636/?ref_=ttep_ep9,,,,,,,,,,,
https://www.imdb.com/title/tt0528616/?ref_=ttep_ep10,,,,,,,,,,,
https://www.imdb.com/title/tt5931646/?ref_=ttep_ep1,,,,,,,,,,,
https://www.imdb.com/title/tt5931648/?ref_=ttep_ep2,,,,,,,,,,,
https://www.imdb.com/title/tt5931652/?ref_=ttep_ep3,,,,,,,,,,,
https://www.imdb.com/title/tt5937294/?ref_=ttep_ep4,,,,,,,,,,,
https://www.imdb.com/title/tt5941434/?ref_=ttep_ep5,,,,,,,,,,,
https://www.imdb.com/title/tt5943926/?ref_=ttep_ep6,,,,,,,,,,,
https://www.imdb.com/title/tt5943928/?ref_=ttep_ep7,,,,,,,,,,,
https://www.imdb.com/title/tt5943930/?ref_=ttep_ep8,,,,,,,,,,,
https://www.imdb.com/title/tt5943932/?ref_=ttep_ep9,,,,,,,,,,,
https://www.imdb.com/title/tt5931656/?ref_=ttep_ep10,,,,,,,,,,,
https://www.imdb.com/title/tt0830035/?ref_=ttep_ep1,,,,,,,,,,,
https://www.imdb.com/title/tt0828979/?ref_=ttep_ep2,,,,,,,,,,,
https://www.imdb.com/title/tt0830034/?ref_=ttep_ep3,,,,,,,,,,,
https://www.imdb.com/title/tt0830435/?ref_=ttep_ep4,,,,,,,,,,,
https://www.imdb.com/title/tt0830705/?ref_=ttep_ep5,,,,,,,,,,,
https://www.imdb.com/title/tt0830438/?ref_=ttep_ep6,,,,,,,,,,,
https://www.imdb.com/title/tt0830436/?ref_=ttep_ep7,,,,,,,,,,,
https://www.imdb.com/title/tt0830439/?ref_=ttep_ep8,,,,,,,,,,,
https://www.imdb.com/title/tt0830437/?ref_=ttep_ep9,,,,,,,,,,,
https://www.imdb.com/title/tt0830440/?ref_=ttep_ep10,,,,,,,,,,,
https://www.imdb.com/title/tt0679832/?ref_=ttep_ep11,,,,,,,,,,,
https://www.imdb.com/title/tt5534132/?ref_=ttep_ep1,,,,,,,,,,,
https://www.imdb.com/title/tt5760298/?ref_=ttep_ep2,,,,,,,,,,,
https://www.imdb.com/title/tt6132782/?ref_=ttep_ep3,,,,,,,,,,,
https://www.imdb.com/title/tt6321280/?ref_=ttep_ep4,,,,,,,,,,,
https://www.imdb.com/title/tt6321282/?ref_=ttep_ep5,,,,,,,,,,,
https://www.imdb.com/title/tt6321284/?ref_=ttep_ep6,,,,,,,,,,,
https://www.imdb.com/title/tt5824790/?ref_=ttep_ep7,,,,,,,,,,,
https://www.imdb.com/title/tt5824794/?ref_=ttep_ep8,,,,,,,,,,,
https://www.imdb.com/title/tt6113642/?ref_=ttep_ep9,,,,,,,,,,,
https://www.imdb.com/title/tt6053616/?ref_=ttep_ep10,,,,,,,,,,,
https://www.imdb.com/title/tt20872812/?ref_=ttep_ep1,,,,,,,,,,,
https://www.imdb.com/title/tt21048304/?ref_=ttep_ep2,,,,,,,,,,,
https://www.imdb.com/title/tt21048308/?ref_=ttep_ep3,,,,,,,,,,,
https://www.imdb.com/title/tt21048310/?ref_=ttep_ep4,,,,,,,,,,,
https://www.imdb.com/title/tt21048306/?ref_=ttep_ep5,,,,,,,,,,,
https://www.imdb.com/title/tt21048312/?ref_=ttep_ep6,,,,,,,,,,,
https://www.imdb.com/title/tt21048314/?ref_=ttep_ep7,,,,,,,,,,,
https://www.imdb.com/title/tt21048316/?ref_=ttep_ep8,,,,,,,,,,,
https://www.imdb.com/title/tt21048320/?ref_=ttep_ep9,,,,,,,,,,,
https://www.imdb.com/title/tt21048318/?ref_=ttep_ep10,,,,,,,,,,,
https://www.imdb.com/title/tt4525842/?ref_=ttep_ep1,,,,,,,,,,,
https://www.imdb.com/title/tt4550416/?ref_=ttep_ep2,,,,,,,,,,,
https://www.imdb.com/title/tt4603116/?ref_=ttep_ep3,,,,,,,,,,,
https://www.imdb.com/title/tt4944380/?ref_=ttep_ep4,,,,,,,,,,,
https://www.imdb.com/title/tt4955280/?ref_=ttep_ep5,,,,,,,,,,,
https://www.imdb.com/title/tt4955282/?ref_=ttep_ep6,,,,,,,,,,,
