episode_link,wiki_url,description,genres,age_rating,release_date,directors,writers,cast,tags,character_names,synopsis_with_character_names
https://www.imdb.com/title/tt2806892/?ref_=ttep_ep5,,"Flint and his crew of the Walrus play a deadly game of naval warfare when they engage Captain Bryson and the Andromache on the open sea to gain precious cargo. Meanwhile, Richard forces his daughter's hand about his business when he makes an announcement to the locals about his assets being liquidated, causing a mob to riot against Eleanor who seeks help from Hornigol... Read all",[],TV-MA,Release date,['Marc Munden'],"['', '', '']",[],"['brothel', 'prostitute', 'father daughter relationship', 'slavery', 'long john silver', 'sword', 'explosion', 'handcuffs', 'south-pacific']",[],"The Walrus chases after the Andromache, which is fleeing with the guns they need. Flint accuses Billy of not trusting him anymore. Billy wonders about how Flint has lied to the crew, but Flint plays it off as something that a good captain needs to do to maintain morale. Billy asks about Mrs Barlow, but Flint claims that she is just a Puritan woman who he has taken as a lover.

Jack Rackham, Vane, and Anne Bonny, arrive at Noonan's brothel and inform the madame that they are the new owners.

Eleanor wonders about why Scott would betray her and returns to her offices where she finds John Silver handcuffed to the injured Randal. Outside her office, her father informs a crowd that he is a wanted fugitive and tells them that Captain Bryson liquidated their holdings and that their business there will be ended.

Looking to gain another knot of speed, Flint orders the raising of the topgallants, an act which Mr Degroot feels jeopardizes the ship. Billy supports the Captain's order and they gain the needed speed.

Mr Guthrie tells Eleanor that their criminal business is ended and that he intends to throw his lot in with the landlords with whom he has been cultivating relationships. He asks Eleanor to swallow her pride and join them, but she refuses. Meanwhile, an angry crowd grows outside her offices, looking to get back whatever money they can. Captain Hornigold has his men protecting her offices and urges her to scrape together whatever money she can to settle her outstanding debts.

Billy Bones lays out to the crew their plan of attack. As they approach, Bryson will likely turn his ship to fire on them. Since they are outgunned they cannot trade fire with him and so will go straight at him. But to allow them to board they will have to get Bryson to turn his ship so that it runs alongside theirs. Billy informs them that Mr Beauclerque will ""convince"" Bryson to do so. Billy has also informed Dufresne, the ships accountant, that all hands will need to take part in the boarding, including him. To steady the man's nerves, Billy tells him that no one on the ship has ever died on their first time boarding.

Bryson turns his ship and opens fire. As he does so, Mr Beauclerque, perched in the crow's nest with a rifle, shoots the man at the Andromache's wheel. When another replaces him, Beauclerque shoots him. Eventually, the Andromache turns and the Walrus comes alongside her.

The pirates leap across the gap between the two ships and begin to board. Terrified, Dufresne goes as well. One of the Andormache's defenders points a pistol at him and pulls the trigger, but it misfires. The two men wrestle and Dufresne ends up biting out the man's jugular before passing out. He is found, covered in blood, by Billy Bones.

Back at Nassau, Eleanor has called together a meeting of several captains. She proposes to start a new trading consortium using her contacts and their ships to move trade. She argues that the captains there, who own large ships but are poor pirates, will earn more money as traders. Eleanor asks Hornigold to bless their operation in order to get people to sell to them. Hornigold says that he will only do so if she agrees to lift her ban on Vane. Eleanor angrily refuses.

Aboard the Andromache, the Walrus' crew begins searching the ship. Bryson and many of his men are barricaded below decks. They shoot several of the Walrus crew who approach their hiding place. Flint is informed that Bryson has cut the link between the steering wheel and the rudder. Bryson decides to deliver his terms. He goes below decks to where a number of slaves are chained in the hold. Among them is Mr Scott. Bryson says that Guthrie ordered him to get rid of Scott. They kill a couple of slaves until one of them agrees to act as a messenger.

Back at Nassau, John Silver advises Eleanor to give up the ban on Vane. He says that it's not worth giving up everything she's built to punish Vane.

Gates lays out the situation to Flint: Bryson's men are barricaded in a section of the ship with walls and ceiling as thick as the outer hull. It's also right next to a powder magazine and so they cannot blow their way in without risking the whole ship.

Dufresne is going through Bryson's papers. He tells Billy that he has remembered a crew member who died on his first boarding. Billy names a half dozen others as well, indicating that he had lied to buck up Dufresne's spirits. Dufresne thanks him. Billy then notices a letter on Bryson's desk addressed to Miranda Barlow and pockets it.

The slave messenger emerges from the hold. Communicating through an African member of the Walrus' crew, he relays a message from Bryson. The message says that before Bryson left he sent a message to the Captain of the ship Scarborough, telling him where to find them. A sail is spotted on the horizon. Just then, the slave lights a grenade and rushes toward Flint. Billy shoots him dead and the man's dead body muffles the grenade blast."
https://www.imdb.com/title/tt2843802/?ref_=ttep_ep6,,The costs of chasing the Andromache continue to mount. Eleanor needs Silver's help. Billy wants Gates to confront Flint. Bonny takes a stand.,[],TV-MA,Release date,['T.J. Scott'],"['', '', '']",[],"['female nudity', 'long john silver', 'drowning', 'handcuffs', 'theft', 'explosion', 'fall', 'abuse', 'diving', 'south-pacific']",[],"It looks like we don't have any synopsis for this title yet. Be the first to contribute.
Learn more"
https://www.imdb.com/title/tt2939430/?ref_=ttep_ep7,,Flint tells Gates the truth. Randall puts Silver in a bind. Eleanor suffers a loss. Max comes to Rackham's aid. Vane enters the fight of his life.,[],TV-MA,Release date,['Marc Munden'],"['', '', '']",[],"['south-pacific', 'tied to a bed', 'bare chested male bondage', 'pubic hair', 'male pubic hair', 'long john silver']",[],"It looks like we don't have any synopsis for this title yet. Be the first to contribute.
Learn more"
https://www.imdb.com/title/tt2843830/?ref_=ttep_ep8,,"Silver gives Flint the last details of the schedule with the location of the ship. Eleanor's situation changes when the supply ships get sunk in the bay. Meanwhile with Mutiny rising up aboard the Walrus, Gates makes a vital decision.",[],TV-MA,Release date,['T.J. Scott'],"['', '', '']",[],"['prostitute', 'prostitution', 'female rear nudity', 'female frontal nudity', 'female full frontal nudity', 'sex with prostitute', 'woman on top', 'long john silver', 'duel', 'execution', 'explosion', 'escape', 'south-pacific']",[],"It looks like we don't have any synopsis for this title yet. Be the first to contribute.
Learn more"
https://www.imdb.com/title/tt10161330/?ref_=ttep_ep1,,"Loki, the God of Mischief, finds himself out of time and in an unusual place and forced - against his godly disposition - to cooperate with others.",[],TV-14,Release date,['Kate Herron'],"['', '', '']",[],"['loki', 'time travel', 'magic', 'escape', 'multiverse', 'hunter', 'female hunter', 'commercial air travel', 'd.b. cooper character', 'miss minutes character', 'year 1971', 'reference to d.b. cooper']",[],"New York City 2012

At the Avengers Tower, the Avengers minus the hulk tale Loki and the Tesseract down the elevator to the lobby The future Ant-Man and Tony Stark try to steal the Tesseract, and it ends up knocked over by Loki. Loki grabs it and teleports away.

In the Gobi Desert, Loki ends up falling into the sand after materializing in mid-air and falling. Several local tribesmen approach him, and Loki gets up on a rock outcropping and declares who he is. A portal opens and three Time Variance Authority police--Minutemen--come through it. They find the nearby tesseract, and Loki goes over and tells them not to touch it. Another officer, Hunter B-15, comes through and declares Loki a ""variant"". B-15 arrests Loki on behalf of the TVA for crime against the sacred timeline.

Loki isn't impressed, and tells them it's their last chance. B-15 hits him in the mouth with her baton, slowing him down to 1/16th speed, and puts a collar on him. When Loki collapses, the officers pick him up and B-15 tells the other officer to reset the timeline. As he plants a reset charge and activates it, B-15 picks up the Tesseract and takes Loki to the TVA base. Loki tries to run, but B-15 uses a remote and the collar it controls to reset Loki back to where he was. He tries to run again, and B-15 brings him back again.

B-15 has a clerk, Casey, enter the Tesseract into evidence. Loki tells Casey to be careful with the Tesseract as B-15 leads him off and shoves him into a cell with a robot. The robot disintegrates Loki's Asgardian clothing and then a trapdoor drops him into an office below. Loki is clothed in a gray prison jumpsuit, and another clerk at a desk shoves a pile of paper at Loki and tells him to verify it's everything Loki has ever said.

Loki finally signs and falls through another trapdoor, and a clerk has Loki testify that he's an organic being and possesses a soul. Once Loki does, the clerk tells him to move through an archway that will melt him from the inside if he is a robot. The archway takes a picture of Loki's temporal aura and a guard tells Loki to take a ticket. There's one other prisoner there who arrived when Loki did, and Loki takes a ticket on the guard's orders.

As Loki moves through the barriers, an animated presentation with Miss Minutes tells him that he's at the TVA and it's her job to catch Loki up before he stands trial for his crimes. She explains that there was a multiversal war and hundreds of warring timelines, and then three Timekeepers reorganized the universe into a single timeline, the sacred timeline. Now the Timekeepers preserve the proper flow of time for everyone and everything, but ""variants"" veer off the created path, people like Loki. They create a nexus event, which could lead to another multiversal war.

The Timekeepers created the TVA to deal with variants, setting time back on its proper path. Since the variant doesn't have a place in the timeline anymore, they have to stand trial for their offenses.

The other prisoner protests and a guard disintegrates him because he doesn't have his ticket. Loki quickly produces his.

In a church in Aix-En Province, France, in 1549, TVA Agent Mobius examines several dead Minutemen. Another Minuteman informs Mobius that when they arrive to investigate a nexus event, someone killed them. Mobius notes that the stab wounds appear consistent with the others on dead Minutemen, and the reset charge is gone. A Minuteman notes that it's the sixth attack in the last week, and a young local boy comes in.

Mobius approaches the boy and asks him if he saw who killed the Minutemen. The boy points at a nearby painted window showing the Devil, and Mobius says that the devil is afraid of them and they'll put the boy back where he belongs. The boy smiles, revealing blue tainted teeth, and Mobius asks what caused it. In response, the boy takes out a stick of blue gum and Mobius realizes the ""devil"" gave it to the boy.

The Minuteman warns Mobius that the timeline is near redline and they have to go. Mobius has the boy go outside, and as the Minutemen set a reset charge, a clerk portals in and shows Mobius the file on Loki, saying Mobius will want to see it.

B-15 brings Loki into a courtroom, and Judge Ravonna Renslayer says that he's charged with numerous sequence violations. Loki says that a god doesn't plead, and says that the Avengers are the ones who traveled through time. Mobius comes in and takes a seat, as Loki tell Ravonna that she should give him a taskforce to go after the Avengers. Ravonna says what the Avengers did what was supposed to happen, and Loki escaping was not, according to the Timekeepers.

Loki says that he should talk to the Timekeepers, but Ravonna says that they're busy dictating the proper flow of time. When he tries to teleport away, Loki discovers that his powers don't work. Ravonna tells him that magic powers don't work in the TVA, finds him guilty, and sentences him to be reset.

As Minutemen take Loki away, Mobius approaches the bench. Ravonna warns Mobius that what he's thinking is a bad idea, and if anything goes sideways it's on him. Mobius takes Loki to his office via a balcony overlooking the majestic TVA base. They then take an elevator down, and Mobius introduces himself. Mobius explains that he's taking Loki somewhere they can talk, and they both know that Loki loves to talk.

Mobius gets a baton from a guard and leads Loki into Mobius' office. Loki tries to attack Mobius, and Mobius uses a remote to move Loki back to where he started. Mobius has Loki sit down and then explains that he specialized in the pursuit of dangerous variants, and Loki isn't one of them. If Loki answers his questions honestly, then maybe Mobius can give Loki something he wants.

Starting with his first questions, Mobius asks Loki what he'll do if he returns. Loki says that he'll reclaim his throne, and Mobius wonders why someone with so much range just wants to rule.

Mobius then plays a film of some of Loki's ""greatest hits"". The agent points out that for someone ""born to rule"", Loki loses a lot. It might even be in his nature. When Loki notes that he killed Coulson, Mobius remind him that the Avengers united to avenge Coulson's death at Loki's hands. Mobius asks Loki if he enjoys hurting people, and Loki insists that he's a liberator.

The agent says that Loki is good at doing awful things and getting away, and plays a film of Loki posing as ""Mr. Cooper"", a passenger on a jetliner, hijacking the plane, jumping out with a bag of money. Heimdall teleports Loki away as he falls. Loki tries leave, disgusted with the conversation, and Mobius rewinds Loki back to his chair.

Loki asks Mobius what he wants, and Mobius says that he wants Loki to be honest about why he does what he does. Unimpressed, Loki says that the TVA is an illusion conjured by the weak to inspire fear. He insists that his choices are his own, and Mobius shows Loki a clip of him dominating a crowd in Berlin. Loki insists that when he has ultimate power, it will be cause of what he did, not because it was supposed to happen or because the TVA allowed it to happen. He dismisses the TVA as a footnote in his ascent.

Mobius explains that if Loki hadn't reacquired the Tesseract, he would have been taken to a cell on Asgard. The agent explains that the TVA can see Loki's future, and in the film it shows Loki's mother Frigga confronting Loki and then Loki sending the Dark Elves to kill Frigga. Loki insists that Mobius is lying, and Mobius tells Loki that it's the proper flow of time, and it happens again and again. He asks again if Loki enjoys hurting people, and Loki throws his chair at him in fury.

Mobius rewind Loki back to where he was sitting, but the chair isn't there so Loki falls on the floor. He then tells Loki that he was born to cause pain and suffering and death, and that's how it will always be... so that others can achieve their best versions of themselves. Mobius helps Loki up, and B-15 comes in and asks Mobius what he's doing. Mobius says that he's doing his job, and she says that they have a situation. The agent tells Loki to stay put and leaves with B-15.

Outside, B-15 tells Mobius that talking to the variant is a mistake. She says that they've lost another Minuteman unit, and Mobius goes back in to discover that Loki has escaped... and stole the time rewinder remote from him.

Loki returns to where he was, and spots Casey wheeling a card.

Mobius, B-15, and a squad of Minutemen search for Loki.

Loki slips into the room with Casey's desk, grabs the worker, and shoves him down. The Asgardian tells Casey to give him the Tesseract, and Casey opens his desk drawer and gives Loki the Tesseract. There are dozens of Infinity Stones in the drawer as well, and when Loki sees them, Casey tells him that they get a lot of them and some of the clerks use them as paperweights. Shocked, Loki wonders if the TVA is the greatest power in the universe.

B-15 comes in and Loki uses the twister to twist himself away. B-15 and her men continue their search for Loki.

Loki rewinds back to the office, and rewinds the film of his life to the point where Frigga is dead. He then finds his future where he and Thor meet Odin, and then further to where he and Thor join forces. Loki then plays the moment of his death, when Thanos kills him.

The film ends and Loki chuckles, and B-15 comes in and asks him what's so funny. He attacks B-15, and she easily gets him in arm hold. Loki uses the remote to remove the collar, put in on B-15, and rewind her repeatedly so she never touches him. Loki finally rewinds her out of the room.

Casey tells two Minutemen about his encounter with Loki. B-15 appears in front of them and storm off, disgusted.

Mobius returns to his office and tells Loki that there's nowhere left for Loki to run. Loki figures that he can't go back to his timeline, and says that he doesn't enjoy hurting people but he does it because he has had to. It's part of the illusion, a desperate play for control. Mobius figures that Loki does know himself and says that he doesn't see Loki as a villain.

Loki notes that the Tesseract is useless in the TVA, and Mobius says that he can offer Loki something better than salvation. He explains that a variant has been killing their Minutemen, and he needs Loki to help stop the variant. When Loki wonders why him, Mobius tells him that the variant they're hunting is Loki.

In Salina, OK, in 1858, a squad of Minutemen appear in a field. There's a sword driven into the ground, and the Minutemen confirm that it's anachronistic. There's oil on the ground, and they set a reset charge to ""prune"" the timeline. One of them spots the hooded Variant a few hundred feet away. He drops a lamp on the ground, and it bursts igniting the oil.

The Minutemen are set on fire and die, and the Variant picks up the reset charge."
