episode_link,wiki_url,description,genres,age_rating,release_date,directors,writers,cast,tags,character_names,synopsis_with_character_names
https://www.imdb.com/title/tt2104518/?ref_=ttep_ep15,,"David faces questions about Kathryn's disappearance and Emma gives Ruby a job as her assistant, as flashbacks show Red Riding Hood attempt to kill a wolf preying on her village.",[],TV-PG,Release date,['Ron Underwood'],"['', '', '']",[],"['chained to a tree', 'scar', 'crossbow', 'werewolf', 'tavern', 'female werewolf', 'killed by a werewolf', 'snow', 'snowy weather', 'volkswagen beetle', 'volkswagen bug', 'yellow volkswagen', 'yellow car', 'snow white character', 'prince charming character', 'friendship', 'murder', 'evil queen from snow white character', 'action girl', 'based on fairy tale', 'curse', 'enchanted forest', 'erased memory', 'fairy tale', 'fairy tale fantasy', 'wolf', 'well', 'arrow', 'silver arrow', 'blackout', 'silver', 'dead body', 'heart', 'passed out', 'chain', 'forest', 'woods', 'blood', 'grandmother granddaughter relationship', 'waitress', 'magic', 'blood on snow', 'blood in the snow', 'fantasy reality crossover', 'urban fantasy', 'fantasy drama', 'teen fantasy', 'live action fantasy', 'medieval fantasy', 'murder suspect']",[],"At the Sheriff's station, Emma talks to David about Katherine's disappearance. He can't explain the phone call that shows up on his records. Emma still doesn't think he's lying, but points out he's not in a great spot. She lets him go, but suggests he get a lawyer.

At Granny's, Ruby flirts with August (Eion Bailey), asking him about his travels. Granny (Beverley Elliott) calls for her, but Ruby blows her off. ""Ruby, stop flirting and get over here,"" Granny commands.

In fairyland, Ruby/Red opens the shutters to her cottage for a young suitor named Peter. He wants her to run away with him, but she's afraid to cross Granny.

Red says good-bye to her suitor and answers Granny's calls. There's a hunting party at the front door preparing to set off after the wolf that's been killing sheep. Red is going stir crazy. Granny won't let her go out with the wolf on the prowl. And she has to keep her hood on -- Granny says red repels wolves.

Granny and Red barricade up the cottage. Red heads to bed as Granny mans the front door with a crossbow.

Back in the diner, Ruby is mad at Granny for embarrassing her. Granny wants her to work Saturdays and she wants to train her how to do the books. Ruby objects. Granny tells her she dresses like a drag queen during fleet week. ""And you dress like Norman Bates when he dresses like Norman Bates' mother,"" Ruby shoots back.

Granny tells her it's time she grows up, and reminds her as long as she works there she has to listen to her rules. They start arguing. Ruby quits and walks out.

Back in Fairyland, in the morning they open up the cottage and Ruby gathers eggs from the chickens in the coop. She hears something hiding. It's Snow White.

They head to the well. Ruby tells her about the killer wolf. They see its handiwork: the hunting party has been slaughtered.

Back in Storybrooke, Mary Margaret asks Emma about David. Emma prepares MM for the fact people are going to look suspiciously at her and David about Katherine's disappearance.

They come upon Dr. Whale (David Anders) hitting on Ruby, who has her bags packed and is waiting at the bus stop. He scampers off. Ruby tells them about her fight with Granny and she's leaving, but she's not sure for where. MM invites her home with them.

In Fairyland, at a town meeting, the leader of the hunting party regrets he couldn't save his men. Red and Snow, with her face hidden, are at the meeting. So is Peter. Granny tells a story about when she was a young girl and her six older brothers and father went out to kill the wolf. She climbed up on the roof and watched as the wolf slaughtered them all. She fell off the roof and the wolf came over, chomped on her arm and then left her alone.

She shows off the gnarly scar. She warns everyone the wolf cannot be beaten. She urges everyone to hide.

Back at the cottage, Ruby tells Snow about her crush on Peter. Snow thinks Granny is using the threat of the wolf to keep Red from love. Red thinks about it for a minute and then announces they should go kill the wolf.

In Storybrooke, Mary Margaret drives to the edge of town and gets out to look around where Katherine disappeared. She hears something and follows the noise and runs in to David. She assures him Emma knows he had nothing to do with Katherine disappearing. David is in a daze and just keeps saying he's looking. He stumbles off.

Red and Snow trek through the woods, tracking. They find wolf prints.

In Storybrooke, Henry helps Ruby look through help wanted ads at the sheriff's station. Ruby notices the phone keeps ringing. Henry explains it goes to a machine when Emma is busy. Ruby answers it and takes a message, then she handles a call about a prowler, explaining it's a neighbor's dog.

Emma sees her on the phones and offers her a job. Ruby goes out on a lunch run.

Mary Margaret comes and tells Emma about running into David in the woods. ""It's like he was a different person,"" she says.

In Fairyland, Snow and Red keep following the tracks and find the paw prints turn into boots, like he was a wolf that turned into a man.

Red knows ""wolf's time"" is once a month on the full moon. They keep following the tracks and realize they're at Red's cottage. The prints go to her window -- where Peter was.

Red knows Peter didn't join the hunting party last night, but she worries about what will happen tonight.

Snow tells Red to tell him.

Ruby goes in to Granny's and orders lunch, bragging that she's working at the sheriff's station now and helping solve crimes.

Back in Fairyland, Red tells Peter she thinks he's the wolf. He doesn't understand how he could not remember. He suggests she chain him up, just in case.

At the sheriff's station, Henry suggests Emma let Ruby do more because she doesn't remember she's Little Red Riding Hood and has forgotten she's a bada--.

Emma tells Ruby to come with her. They head into the woods looking for David. All of a sudden, Ruby says she hears him and realizes where David is. She finds him passed out on the ground with bump on his head. He doesn't remember anything since he was in Emma's office last night.

Emma takes him to see Dr. Whale, who says it seems like what happened to him when he came out of his coma. Emma wonders what else he could do in that state and not remember. David suddenly worries he could have done something to Katherine. Regina storms in -- she's still David's emergency contact since Katherine is missing. She snarks at Emma to just find Katherine.

Emma calls Ruby and asks her to drive to the toll bridge -- where David went last time during a black out. Emma wants her there before David is released from the hospital.

Ruby drives to the bridge and finds some recently dug up ground. She digs and finds a small wooden box. She opens it and screams.

Back in the cottage, Snow lies in bed, taking Red's place. Granny finds her. Snow explains Red's out with Peter and isn't in danger because he's tied up. ""She's got him tied up? Oh that poor boy,"" Granny says.

Cut to Peter chained to a tree, yelling at Red to stop. She's the wolf.

Back at the station, Emma looks in the box. Ruby asks if it's what she thinks it is. It is.

Ruby's freaked out, but Emma tells her she did a great job finding David and then the box. Emma's impressed.

Granny and Snow head out in the woods to find Red. Granny knew. Red's mother was one, too, but was killed by a hunting party. Red starting turning when she was 13. Granny paid a wizard for the cloak, but Red doesn't always wear it.

The story she told was about Red's grandfather. He marked her that night, then came back and turned her. She says it's mostly faded away, but she's tracking Red by smell. They hear a wolf braying. Granny approaches with the crossbow. They come upon the wolf tearing into Peter.

The wolf turns and lunges at them. Granny shoots her with the arrow. Snow throws the cloak over Red and she turns back. Red is confused. The hunting party is approaching. She turns and sees Peter's body. Snow tells her she's the wolf. Red is distraught as the hunting party appears in the distance, Snow helps her away.

Back in the diner, Ruby visits Granny -- who has the wolf claw scars on her arm. Ruby tells her she wants to come back. She wasn't mad, she was scared of the extra responsibility. Granny assures her she's ready and can handle it. Granny tells her she wanted to learn the books so she could take over the place and own it when she retires. Granny tells Ruby she's proud of her.

Mary Margaret visits with David at the pet shelter, he's worried about what he might have done. Emma joins them. She tells them they found a box and it had a human heart inside. There were fingerprints in the box and a matchto a specific person. David tells Emma to arrest to arrest him.

But the fingerprints weren't his.

They were Mary Margaret's."
https://www.imdb.com/title/tt2104519/?ref_=ttep_ep16,,"Mary Margaret hires Gold as her attorney when she is arrested for the suspected murder of Kathryn, while flashbacks show Charming try to find Snow, whose memory is clouded by Rumplestiltskin's potion.",[],TV-PG,Release date,['Dean White'],"['', '', '']",[],"[""arrow in one's arm"", 'lawyer', 'apple', 'regaining memory', 'female werewolf', 'bird', 'hunting knife', 'stepmother stepdaughter relationship', 'snow white character', 'rumpelstiltskin character', 'prince charming character', 'evil queen from snow white character', 'action girl', 'based on fairy tale', 'curse', 'enchanted forest', 'erased memory', 'fairy tale', 'fairy tale fantasy', 'mugshot', 'fantasy reality crossover', 'urban fantasy', 'fantasy drama', 'teen fantasy', 'live action fantasy', 'brougham carriage', 'carriage', 'horse drawn carriage', 'horse and carriage', 'royal carriage', 'curly hair', 'handsome prince', 'red dress', 'woman wears a red dress', 'medieval fantasy', 'murder suspect', ""sheriff's department"", 'sheriff station', '10 year old son', '10 year old boy', '10 year old', 'short haired woman', 'town hall', 'arrest', 'jail', 'escape from prison', 'jail cell', 'hypnosis', 'key ring', 'arrow']",[],"We begin in Fairy Tale Land, where Prince Charming and Little Red Riding Hood are on the run. Red tells the prince to take off without her. She tells him she's giving him a head start, then, as he rides away, she turns into a wolf and jumps right toward the pack of knights who were chasing them. As he rides away, we catch a glimpse of a ""Wanted"" sign featuring Snow White's face, reading that she's wanted for murder and treason.

Back in Storybrooke, Emma is taking Mary Margaret's mug shots at the sheriff's office. She still doesn't believe Mary Margaret killed Kathryn, but she ""has to go where the evidence leads."" Mary Magaret says it's insane that the evidence shows she cut out Kathryn's heart and buried it. Emma says that if she shows Mary Margaret any favortism, Regina will have her fired and replace her with someone who will railroad Mary Margaret.

In Fairy Tale Land, we see a Snow White who isn't quite so whimsical as we've always thought. She sings to a blue bird until it comes close enough for her to take a swing at it with a broom. When Grumpy asks her what she's doing, she says, ""Getting rid of the vermin in this house."" She doesn't want to eat, but Grumpy tells her he and the dwarves ""made something extra special tonight."" She shows up in the dining area and Jiminy Cricket is there to tell her that her friends have something to tell her. They say she's ""changed."" She hasn't been very nice to any of them, and even Happy is telling her how horrible she's been. Grumpy tells her the potion she drank changed her. She insists the potion was the solution, not the problem. She says the problem is that she's living with dwarves instead of in her palace with her father, as a princess. She's angry at the queen. Jiminy says that's understandable, but it isn't fair of her to take it out on her friends. Snow says he's right, and that she ""should be taking it out on her."" She sets out to get revenge, despite everyone asking her not to. She says she's going ""to kill the queen.""

In Storybrooke, Mary Margaret shows up in an interview room and finds Regina there as a third-party witness to ensure Emma stays impartial. Emma proceeds with questioning that reveals David and Mary Margaret's affair. Emma shows Mary Margaret her own jewelry box, which is what they found the heart in. Mary Margaret insists it must have been stolen. Regina claims to empathize, telling her she knows what it's like to lose someone you love -- and that it changes someone. Emma pulls Regina outside and reminds Regina that she (Emma) was supposed to do the questioning. Regina asks Emma how she's so sure Mary Margaret didn't do it. She says there'd be signs of a break-in if the jewelry box had been stolen, and reiterates to Emma that Mary Margaret had her heart broken, which can make people do ""unspeakable things.""

Back in Fairy Tale Land, we see Snow on her quest for revenge. She sets up a trap to knock a knight of his horse and interrogates him (pretty violently) for information on the queen's whereabouts. He tells her she's in her castle, but will be leaving in the morning for the summer palace. She tells him the summer palace was built for her mother, and knocks him out with the back of her pick-axe. Grumpy finds her taking the knight's armor and asks her what she's doing. She says she's going to do whatever she has to do to get into the castle. He says he's there to help her. He's going to take her back to Rumplestiltskin so he can reserve the memory-altering affects of the potion. Grumpy tells Snow that Rumple ""can do anything."" This gets her attention.

Emma is searching the apartment for signs of a break-in, when Henry shows up to see how he can help. He says Regina has a motive. ""She hates Snow White,"" he says. Emma doubts this motive will hold up in court. They hear a noise and Emma pulls a vent off the floor to discover a knife hidden inside.

Henry is bummed and August finds him at the diner. August urges Henry to look to his book for the answers he's looking for. Henry says ""it's just a book,"" but August says they both know that's not the case. Henry's interest is piqued. August tells Henry he is also ""a believer"" and he wants ""to help others to see the light."" Emma is one of the people he's trying to help believe, and she needs proof. Henry opens up the book.

In Fairy Tale Land, Prince Charming comes across the knight who Snow White assaulted. He tells the prince about Snow White's attack, but the prince refuses to believe that Snow is ""bloodthirsty.""

David visits Regina and tells her he doesn't believe Mary Margaret could have killed Kathryn. Regina tells him ""everyone has a dark side."" David says he doesn't think Mary Margaret could do such an evil thing. Regina says she thinks ""evil isn't born, it's made."" David tells Regina she doesn't know anything about evil. David starts to wonder whether he blacked out and did it himself.

Mary Margaret tells Emma she doesn't even know where the heating vent in her room is. Emma says she still believes Mary Margaret is innocent, but suggests she get a lawyer. Mr. Gold shows up and offers his services. Emma wants him to leave, but Mary Margaret is happy for the assistance. Emma leaves and Mary Margaret tells Mr. Gold she can't pay him. He says he's not interested in money, he has a vested interest in her future.

In Fairy Tale Land, Grumpy is asking Rumple about the potion, which Rumple explains ""took away her love, left a big hole in her heart."" He says there's no potion that can bring back true love, because it's the most true magic of all. He asks Snow what she really wants, and she says she wants his help to kill the queen. He gives her a bow and arrow that always hits its target. He says she'll have to hit the queen with it when she's on her way to the summer palace. Snow asks Rumple what he wants in return and he says he's ""invested in (her) future.""

David pays a visit to Dr. Archie Hopper and asks for help remembering what happened during his blackouts.

In Fairy Tale Land, Prince Charming tracks down Rumplestiltskin. After a little discussion, Rumple tells the prince that true love's kiss will reverse the potion's affects. In return for information on Snow's whereabouts, Rumple wants the prince's cloak. He readily gives it up. Rumple warns the prince to find her quickly, because evil isn't born, it's made. The prince does track Snow down quickly and plants a kiss on her, but she punches him out.

In storybrooke, Henry shows Emma ""proof."" He shows Emma the keys Regina has to all the houses in town. He proceeds to try all the keys on the massive key ring. After a couple of failed tries, Emma agrees to try one more -- and the door opens.

In Fairy Tale Land, Prince Charming comes to and finds himself tied up. Snow still doesn't remember who he is, and she's just as determined as ever to kill the queen. He begs her not to do it as she walks away.

In storybrooke, Dr. Hopper asks David to go back to his last memory of talking to Kathryn. As David is retracing his memories, the ones from Storybrooke and Fairy Tale Land converge in his mind, and he sees a flash of who he thinks is Mary Margaret (but is actually Snow White) in the forest, and he is shouting, ""You can't kill her!"" David's eyes open and he tells Dr. Hopper, ""It was..."" He stops and runs out, telling Dr. Hopper he can't help.

In Fairy Tale Land, Jiminy Cricket finds Prince Charming and helps free him. He tells the prince that Snow can't remember who he (the prince) is until she remembers who she is. We next see Snow tracking the queen and her caravan, and preparing to shoot the arrow. She fires, and Prince Charming jumps in front of the arrow,piercing his shoulder. She asks him what he's doing, and he says he's going to show her actions rather than words. He tells her he loves her, but she says she doesn't love him. ""I don't even remember you,"" she says. He tells her he would rather die than let her fill her heart with darkness.

""You would really die for me?"" she asks. She says no one has ever done anything like this for her before.

""No one you can remember,"" he says. They kiss, and she does remember him, and her love for him. But then King George's soldiers arrive, throw a few punches, and take Prince Charming away as a prisoner. Snow shouts to him ""I will always find you.""

Back in Storybrooke, David visits Mary Margaret in the holding cell. Because his memories are confused, he thinks she wanted to kill Kathryn. He's confused, and they end up fighting. She breaks down and kicks him out.

Back in the Enchanted Forest, Snow returns to the dwarfs, upset. She gives one of the dwarfs a new mug, and apologizes to all of them. It's a happy reunion, but she has to leave again to go after James. The dwarfs agree to go with her.

In Storybrooke, Mary Margaret is making up the cot, and finds a key. It fits her cell. She almost escapes, but Emma returns with breakfast. Emma tells her the DNA of the heart matches Kathryn, so she has no choice but to charge Mary Margaret with murder, though she believes Regina is framing her. Emma plans to take Regina on, but needs time to do it right. Mary Margaret agrees to give her time, then pulls out the key again.

Emma goes to visit Mr. Gold, and tells him what she thinks. She wants advice and help. She doesn't care so much about his methods, so long as it gets results. He tells her she's more powerful than she thinks she is.

In the Enchanted Forest, Rumpelstiltskin is doing something with potions and vials. He mixes Snow White's hair with one from James that he got off of James's cloak.

Back in Storybrooke, we're shown Mary Margaret's empty jail cell."
