episode_link,wiki_url,description,genres,age_rating,release_date,directors,writers,cast,tags,character_names,synopsis_with_character_names
https://www.imdb.com/title/tt10954346/?ref_=ttep_ep6,,"A disturbing death has Gotham reeling and the city reaches out for their new vigilante hero. Luke confides in Kate, while Sophie asks Jacob for a special assignment. Alice continues her nefarious plot against the Kanes, with Catherine being a conduit to part of her plan. Batwoman pays another visit to Mary.",[],TV-14,Release date,['Scott Peters'],"['', '', '']",[],"[""executioner's hood"", 'axe', 'murder', 'tv news', 'security camera footage', 'reference to massachusetts institute of technology', 'booby trap', 'death by electrocution', 'illegal clinic', 'handcuffed to a bed', 'telephone pole', 'downed power line', 'electricity', 'fire hydrant', 'water', 'electrocuted', 'chain link fence', 'bat signal', 'security company', 'assistant district attorney', 'reference to the joker', 'disfigured face', 'disfigurement', 'wig', 'impersonation', 'mimic', 'mimicry', 'reference to lucius fox', 'reference to blackgate penitentiary', 'courtroom', 'voice modulator', 'trip wire', 'trap', 'speaker', 'revenge', 'secret identity', 'medical student', 'impersonator', 'facial recognition', 'high tech weapon', 'capital punishment', 'batcave', 'security guard', 'batarang', 'reference to the penguin', 'false arrest', 'unjust incarceration', 'hydrogen cyanide', 'social media influencer', 'handcuffs']",[],"It looks like we don't have any synopsis for this title yet. Be the first to contribute.
Learn more"
https://www.imdb.com/title/tt10990554/?ref_=ttep_ep7,,"Kate and Sophie must reconcile with their past as Kate questions just how much she can trust her former lover. Kate and Luke have an encounter with an old friend. Mary grapples with the fate of the Kane family as Catherine Seeks Jacob's help. Alice and a new cohort are in on yet another nefarious plan, but her motives are more than they seem.",[],TV-14,Release date,['Michael A. Allowitz'],"['', '', '']",[],"['sniper', 'tv news', 'flashback', 'homophobia', 'female female kiss', 'lesbian sex', ""don't ask don't tell"", 'homophobia towards lesbians in the military', 'lesbians in the military', 'shootout in a restaurant', 'stabbed to death', 'making of a killer', 'lesbian ex girlfriend', 'shot through a wall', 'female police officer', 'police officer beaten', 'reference to bruce wayne', 'restaurant', 'view through rifle scope', 'security company', 'security force', 'radio personality', 'ex girlfriend ex girlfriend relationship', 'batcave', 'husband wife relationship', 'mother daughter relationship', 'bola', 'british accent', 'reference to alfred pennyworth', 'murder', 'scientist', 'prototype weapon', 'reference to metropolis', 'old friends', 'military academy', 'discrimination', 'military cadet', 'learning the truth', 'stepsister stepsister relationship', 'secret revealed', 'secret identity', 'private security', 'expelled', 'breakup', 'motorcycle', 'gps', 'reference to lucius fox', 'trust', 'secret', 'medal']",[],"It looks like we don't have any synopsis for this title yet. Be the first to contribute.
Learn more"
https://www.imdb.com/title/tt11012560/?ref_=ttep_ep8,,"Kate and Alice continue their sister/nemesis dance, while Alice and Mouse construct their most evil plan yet. Mary invites Kate to a special event honoring Catherine and Jacob makes a decision that leaves Kate perplexed.",[],TV-14,Release date,['Holly Dale'],"['', '', '']",[],"['tied feet', 'kidnapping', 'tea party', 'reference to dollywood', 'tranquilizer dart', 'black tie event', 'charity gala', 'speech', 'teleprompter', 'nosebleed', 'poison', 'poisoned to death', 'death of protagonist', 'reference to alice in wonderland', 'jacket', 'batcave', 'staff', 'abandoned warehouse', 'sister sister relationship', 'hideout', 'rabbit mask', 'stepsister stepsister relationship', 'bar owner', 'impersonation', 'impersonator', 'mimic', 'mask', 'captive', 'father daughter relationship', 'abducted', 'husband wife relationship', 'security force', 'security company', 'gala', 'radio personality', 'limousine', 'social media influencer', 'handcuffs', 'humanitarian', 'award', 'theater', 'tied to a chair', 'reference to the joker', 'reference to the riddler', 'collapsing on stage', 'socialite', 'medical emergency', 'criminal gang', 'jealous husband', 'engagement ring']",[],"It looks like we don't have any synopsis for this title yet. Be the first to contribute.
Learn more"
https://www.imdb.com/title/tt11199024/?ref_=ttep_ep9,,"The group uses Ray's invention to track new recruits to help save the universe. The Monitor sends Iris, Clark and Lois in search of a mysterious Kryptonian, while Kate and Kara head out to find Bruce Wayne. In addition, Mia challenges Sara, Rory discovers a hidden talent, and Lex Luthor returns.",[],TV-14,Release date,['Laura Belsey'],"['', '', '']",[],"['crossover episode', 'part two', 'crying baby', 'drinking shots', 'toasting the deceased', 'reference to felicity smoak', 'reference to bruce wayne', 'lex luthor character', 'superman character', 'the flash character', 'supergirl character', 'john constantine character', 'jonah hex character', 'bruce wayne character', 'kicking in a door', 'reference to brawny paper towels', 'chopping wood', 'kryptonite', 'punched in the face', 'alternate version of self', 'lazarus pit', 'mine', 'tranquilizer', 'electrocuted to death', 'drinking beer from a bottle', 'cryptic prophecy', 'pentagram', 'reference to batman', 'reference to superman', 'reference to smallville', 'reference to superman returns', 'crossover event', 'second part', 'part 2', 'multiverse', 'alternate dimension', 'alternate universe', 'parallel dimension', 'central city', 'drinking a toast', 'grieving', 'loss of a friend', 'earth 1', 'crisis', 'planetary destruction', 'antimatter', 'catastrophe', 'sara lance character', 'kryptonian', 'alien']",[],"It looks like we don't have any synopsis for this title yet. Be the first to contribute.
Learn more"
https://www.imdb.com/title/tt11204018/?ref_=ttep_ep10,,"While Gotham busies itself reacting to Batwoman's awkward encounter with a handsome policeman Alice celebrates her ultimate act of vengeance with Mouse. A devastated Mary focuses on Jacob Kane's trial, while Sophie seeks advice about her love life from someone unexpected. As they tackle the newest threat to Gotham, Luke prioritizes protecting Batwoman's secret, and Ka... Read all",[],TV-14,Release date,['Jeffrey G. Hunt'],"['', '', '']",[],"['runaway train', 'subway', 'reference to chris evans', 'reference to keanu reeves', 'reference to captain america', 'cemetery', 'visiting a grave', 'phone call from jail', ""reference to valentine's day"", 'selfie', 'grappling hook', 'voice changer', 'high school', 'bomb', 'locker', 'explosion', 'doxxing', 'magazine cover', 'coming out as a lesbian', 'birthday', 'the cw', '2020s', 'dc comics', 'subway train', 'reference to jagged little pill the stage musical', 'motorcycle', 'batcave', 'police officer', 'newspaper headline', 'radio personality', 'radio show host', 'reference to alice in wonderland', 'tombstone', 'burn victim', 'disfigurement', 'scarred face', 'stepsister stepsister relationship', 'sister sister relationship', 'reference to scarecrow', 'hacker', 'ransom', 'cyber terrorist', 'cyber terrorism', 'mayor', 'cyber security', 'cave', 'prison', 'razor blade', 'razor blade in food', 'prison inmate']",[],"A Gotham elevated train speeds past a station. As the customers complain, the train continues speeding and the driver announces that they've lost their brakes because the computer system is out.

Batwoman speeds to the train's next stop on a new bike, and Lucius tells her what is happening with the train. It passes her on a track and Batwoman speeds after it, snaring the rear with a line on her bike. She then stops the bike and fires another line, stopping the train just before it hits the collision barrier. The hook gives out and a man tackles Batwoman, knocking her out of the way. People take photos of Batwoman and the policeman, Slam Bradley, together.

The next morning, Vesper is talking about Batwoman and Slam together and wonders if they're shipping them. Lucius tells Kate that her street credit is off the charts, and Slam is a hunk on the GCPD calendar. Kate points out that she's gay and it's her birthday, and Lucius tells her that her new ""relationship"" isn't entirely negative. He says that people just want to see Batwoman happy, and Kate tells him that she isn't. As Kate leaves, Lucius discovers that she's reading an article about Jacob's upcoming trial.

Alice has tea at Catherine's gravestone with Mouse, and says that Kate didn't join them. Mouse points out that Kate ignored her messages, and suggests that they celebrate later. Alice is happy that Catherine is dead, and Mouse tells her that the two of them Kate will never be a family. When Alice says that she killed their mutual enemy, Mouse tells her that it's a weakness, not a gesture of affection to Kate. Mouse says that Kate sees a soul worth saving when she looks at Alice, and isn't going to sip tea with fugitives. As long as Kate wears her mask, Alice will never bring Kate into their family.

At the clinic, Mary blogs about how she's human garbage because Jacob is a murdered and Catherine's company is corrupt. She signs off and tells everyone to be better, and Kate comes in. Mary isn't thrilled that Alice poisoned Catherine, and tells Kate that she, Sophie, and Jacob have already put together a strike team to bring in Alice. When Mary reveals that Alice desecrated Catherine's grave, Kate is shocked and apologizes to Mary. Mary says that Kate ignored her when she said Alice was dangerous, and tells Kate to leave.

Lucius and Kate check out the train, and Lucius says that the black box shows no indication of hacking. Kate turns off the lights and finds an electronic device. Lucius concludes that it's packet analyzer that the hacker used to override the train computer. The hacker calls everyone in town on their phones, and says that if people don't pay him $5 million via crowdfunding, he will reveal everyone's secrets. The hacker, Terrier, hints that he knows Batwoman's secret identity.

The mayor soon gives a press conference talking about the press conference. He insists that they have layers of cyber security in place, and Kate and Lucius watch from the Batcave as Terrier access the TV broadcast and gives everyone the mayor's credit card number. Lucius shuts down the Batcave computers, warning that Kate's identity is in danger. She suggests that he trace the IP address, and figures they have to turn on the computer so Lucius can trace Terrier Kate does it anyway and Lucius tells her that they'll go dark in five minutes before going to work.

In prison, Jacob is eating by himself. A prisoner sits down next to him and asks where his ""bite"" is, and welcomes Jacob ""home"". Jacob gives the prisoner his food and walks off. When Jacob calls Mary, she says that they got his trial moved up to after Valentine's day. Mary is trying to find a doctor who will testify that face-swapping is possible. Mary tells her to stop and asks how she's dealing with Catherine's death. He suggests that Mary talk to someone, and insists that he never stopped being Mary's dad despite his issues with Catherine. Mary isn't interested and tells him to sit tight while she finds someone to help him.

That night, Lucius traces the hacking device and Batwoman goes to the warehouse. The comms are dead, and Batwoman finds Sophie and her Crow officers interrogating the hackers. The head hacker insists that they're not terrorists, but Sophie doesn't believe him. When the hacker says that it wasn't them, Sophie punches him and walks off.

When Sophie goes outside, she hears Batwoman grapple down. Batwoman asks Sophie if she wants to talk about it, and Sophie finally says that her husband left her because he thinks she's lying to herself. When Batwoman asks if she is, Sophie admits that she might be and suggests she's too terrified to deal with it. Batwoman suggests that Sophie take off her mask, and Sophie says that she's one to talk.

Mary approaches Dr. Campbell as he leaves his college lecture, and asks him if he'd be an expert in Jacob's trial. She says that Jacob was set up by a man who used a mask made out of human skin, and Campbell is an expert on the topic. Campbell insists that it isn't possible, and suggests that Mary was under e4xtreme duress and imagined what she thinks she saw. With that, Campbell leaves.

When Kate returns to the Batcave, she complains that Luke shut off the comms. He tells her that he did to protect them against Terrier, and Kate wonders if she's a fraud. She feels like she's lying to the entire city because she wears a mask and pretends to be involved with a man. Lucius points out that the citizens think Kate is a hero and she is, and gives her an electric charge disruptor that will kill every electrical current within 100 meters for ten seconds. Lucius figures that if Terrier's phone is proof against the device, Kate can use the disruptor and then they can track the only active phone. He has done a reverse audio modulation and discovered that she's a young girl. When Kate has Lucius lower the tone, they hear a bell in the background and she recognizes it: Gotham Prep: Kate's old high school.

Mary calls Sophie and tells her what Campbell said. Sophie suggests that Mary talk to Kate, and promises that they'll find someone who can help Jacob. Mary is at Gotham University and Alice walks by, and Alice goes after her. Sophie tells her to get out and she's sending a team, but Mary hangs up and follows Alice.

Batwoman drops into a Gotham Prep dance and loudly asks who Terrier is. One student takes a selfie with Batwoman and other students crowd her. Batwoman activates the disruptor and all of the phones and lights shut down. As the kids boos, Batwoman uses special contact lenses to spot one girl leaving with an active phone, and follows her into the restroom.

The girl, Parker Torres, says that she's just a kid at a dancer. Batwoman plays back Terrier's recording as Terrier, and Parker says that she wasn't going to crash the train. She was on the train controlling it from her phone and was going to stop it, but Batwoman stopped it first. Parker says that it was a prank, and she thought if she could scare her parents, they'd stop thinking of her as a freak. She explains that she's gay, and her ex Kayla Mason outed Parker to her parents. Parker couldn't tell the truth so Kayla told Parker's parents for her. Parker needed the money to get out. Batwoman says that it's not an excuse to endanger hundreds of lives, but Parker says that her parents hate her and so does she. Parker figures that Batwoman was the hottest school when she was in high school, and they have nothing in common. She tells Batwoman to leave her alone and walks out, and Batwoman looks at herself in the mirror.

Sophie and her men arrive at Gotham U and go to the room Mary saw Alice go into. They break into the dorm room and find a male student there.

Alice approaches Parker, who recognizes the villainess. As Alice says that she knows Parker is Terrier, Batwoman arrive and attacks Alice. Alice knocks her out with a trophy then knocks down Parker as she runs and says that she needs her.

When Alice takes Parker to the shop room, she ties her up and threatens her with a powered saw. She says that Parker's roommates tagged Batwoman. Batwoman comes in and Alice says that she needs Batwoman to figure out she's not a human. Alice insists that Parker is an important tool in her plan, and she'll tell Batwoman once she takes off her mask.

Mary is at the clinic packing up her things when Sophie comes in. When she wonders what's going on, Mary says that there's no point being a doctor if she can't save her mother. Sophie says that Alice wasn't at Gotham University and suggests that Mary hallucinated her because her world fell apart. She talks about how her marriage blew up and she'd rather do anything than feel their feelings. Mary insists that she's not imagining things, and Sophie tells her that finding Alice won't bring Catherine back.

Alice tells Batwoman that she's obsessed with saving people who don't want to be saved. Batwoman tells Alice that she's sick and prepares to cut Parker open. Kate removes her mask and Parker stares at her in shock, recognizing her. She apologizes for being a bitch to Kate earlier when she said she couldn't understand being gay. Alice interrupts , saying that she needs Parker to out Kate as Batwoman. She insists that no one is going to change who she is. Parker asks what Alice will do if she refuses, and Alice finally says that she will blow up Gotham Prep with the C4 that she planted at the dance and she's holding the detonator.

Parker refuses to out Kate, but Kate tells her to do it. The student says that if Batwoman goes away, Gotham's hope goes with it. Kate tells her to tell everyone and gives Parker her phone, and Parker agrees. She finally says that she did it, and cell phones ring throughout the city broadcasting that Kate is Batwoman.

At the Crows HQ, Sophie gets the message and tells a team to go with her to Gotham Prep.

When Alice sees the message, she frees Parker. Kate tells Parker to go, then punches Alice, handcuffs her to a railing, and asks how to disarm the bomb. Alice insists that she fixed Kate's life, and she's already punished Jacob and Catherine. Kate tells her to take all of her ""gifts"" back, and Alice asks Kate to be her sister. Her sister says that Beth died and the world would be better if she stayed dead. When Alice tries to touch Kate's face, Kate grabs it and police sirens approach. Kate says that Parker sent a message to the Crows saying Alice is at Gotham Prep.

Sophie and her men arrive and establish a perimeter, Slam arrives and orders everyone to go out while he enters the gym.

Alice reveals that the detonator she's holding isn't the real one.

Mouse is in a nearby car and blows up the school. Everyone gets out and stares at the burning wreckage in shock. Batwoman managed to get Slam out, and the crowd chant at them to kiss. When Slam tries, Batwoman shoves him back and says it isn't happening.

The next day, Parker visits Wayne Tower and asks where her Batbike is. Kate tells Parker that she'll be doing community service scrubbing graffiti because of what she did, and is going to play back the blackmail money. Parker assures Kate she won't reveal her secret, and Kate figures that she won't and dismisses her. As Parker goes, Kate tells her that eventually Parker will stop hating herself. She says that she's there if Parker wants to talk about what she's going through. Parker says that she's glad that Batwoman is someone like him.

The mayor hands Alice over to the Crows. Sophie visits Alice in a Crows interrogation room and says that she's not going anywhere until she reveals where Mouse is. Alice just laughs.

Lucius meets Kate in the Batcave and gives her a birthday cupcake, and she asks him not cut her off on the comms again. Kate blows out the candle on the cupcake and Lucius leaves.

Vesper is son announcing that Batwoman is a lesbian because of what happened with Slam, and wonders when they stopped letting their politics.

Sophie reads the article.

Parker reads the article and smiles.

Mary calls Campbell and tells him that she's not crazy. Kate visits her and after a moment, Mary cries and hugs her.

Later, Kate calls Jacob. Jacob says that the two of them will need each other more than ever, and wishes Kate a happy birthday. When Kate enters her office, she finds Alice waiting for her. Alice has brunette hair and apparently doesn't remember anything she did as Alice. Kate grabs her and yanks at her face to discover if she's wearing a mask, and Alice insists that she's Beth."
